titulo;cuerpo;sentimiento
Efectivizar Criptomonedas en Paraguay;"Buenas a todos.

Como puedo efectivizar mis criptomonedas aqu¡ en Paraguay? Tengo BTC, ETH, USDT pero quiero efectivizarlo a Gs o USD, cualquiera de las dos me sirve. Si alguien podria guiarme como, si hay una entidad en donde acudir o cualquier otro m‚todo.";Positivo
Efectivizar Criptomonedas;Saben como puedo efectivizar mis criptomonedas acumuladas en binance? tengo unos dolares acumulados pero no se como puedo efectivizarlos...;Positivo
criptomonedas en paraguay;Saben como puedo comprar bitcoins o alguna moneda desde paraguay? Satochipa te cobra una comisi¢n muy alta y desde apps que conozco solo se puede comprar m¡nimo 30$;Neutral
D¢nde comprar criptomonedas en Paraguay?;Buenos d¡as, estaba buscando la forma de comprar algunas criptomonedas pero hasta ahora no encontr‚ ninguna forma de comprar criptomonedas de forma segura al menos en Paraguay. ¨Que p gina o App recomiendan para adquirir?;Neutral
Billetera cripto: gente, evidentemente dejar criptomonedas en exchanges est  visto que no es seguro (sobre todo al ver lo de FTX). Que Wallet recomiendan? Que sea segura sin que sea una cold Wallet?;(sin texto);Negativo
Trabajo para una grande empresa de miner¡a de criptomonedas en Paraguay, hagan sus preguntas.;Responder‚ todo lo que no sea de car cter personal o confidencial, come on!;Neutral
Crypto en Paraguay, ¨ya est n bien utilizados?;¨Ustedes de Paraguay usan criptomonedas?  Soy de Brasil, si voy con d¢lares en binance, ¨podr¡a retirar estos d¢lares?  ¨Las tiendas aceptan criptomonedas?;Neutral
"Criptomonedas; que opinan del proyecto de ley; a favor, en contra, sugerencias?";(sin texto);Neutral
mineria de criptomonedas;"Buenas tardes gente quisiera saber como podria minar cripto desde casa, cuanto es la capital o fondo minimo que necesito para empezar y si vale la pena, tambien me interesaria saber alguna sugerencia acerca de que cripto podria minar, ya que £ltimamente me empezo a interesar el tema por que lei que el costo de electricidad de este pais es ""bajo"" en relaci¢n a los otros pa¡ses donde mas bitcoins se mina";Neutral
¨Como invertir?-Criptomonedas/Trading;"Me surge la pregunta si es conveniente invertir y si es rentable con poco riesgo de p‚rdida 
Alguien conoce Comerce IQ?";Neutral
Crypto mineracion en Paraguai;"Alguien por aqui Hace mineracion de Criptomonedas en Paraguay?

He visto varios videos de personas usando Asics y gpus en Paraguay, qual es el kwh ?";Neutral
Buenas, alguno aqu¡ utiliza la aplicaci¢n Hapi (App para comprar acciones, ETFs y criptomonedas desde Latinoam‚rica) que tal es aqu¡ en Paraguay? O si me recomiendan alguna para empezar con el trade de acciones!?;(sin texto);Neutral
¨Hay manera de comprar comida con criptomonedas?;"Hola, consegu¡ un ""trabajo"" por internet y me depositan en USDT, me gustar¡a saber si existe alguna opci¢n para hacer compras, espec¡ficamente de comida a trav‚s de criptomoneda en Paraguay, estuve investigando un poco y vi que existen esos servicios en Chile, Argentina y M‚xico, pero sobre Paraguay no encontr‚ nada y la verdad que tampoco estoy muy esperanzado de que se pueda, pero si alguno conoce de alg£n supermercado/restaurante que acepte criptomoneda estar¡a bueno que me lo pueda recomendar :D";Neutral
Ingresar dinero de venta de criptomonedas en la banca paraguaya;Hola, ¨alguien se maneja en cripto por aqu¡?. Me consta que en Paraguay la ley permite cambiar criptomonedas por dinero de curso legal y por bienes y servicios pero a la vez los bancos parece que no aceptan dinero proveniente de esas actividades. ¨Alguien conoce qu‚ formas usan los inversores cripto para meter su dinero en el banco?;Neutral
Ley de Miner¡a en Py;"Se aprob¢ la ley de miner¡a en Paraguay, lo que convierte a esa actividad en una fuente gravada y regulada por el estado.

Obviamente la ley no da ninguna ventaja a los mineros, pero me pregunto si eso dejar  la puerta abierta a que se empiecen a aceptar las criptomonedas como medio de pago.

Esta apertura, beneficiar  o perjudicar  al minero y a la sociedad? Ya que el senador Buzarquis est  promoviendo el minado de BTC como si fuera la panacea a todos los males.



Saludos!";Neutral
Criptos;Alguien sabe del grupo de pyos que tradean/holdean con criptomonedas?;Neutral
JUEGOS NFT Y CRIPTOMONEDAS;que tal gente, ¨C¢mo andan?, Llevo un tiempo haciendo peque¤as inversiones en criptos y ahora me estoy metiendo en los juegos nft. Entre pensar y pensar me di¢ curiosidad saber si alguien de los compatriotas aqu¡ presentes tiene alguna inversi¢n con alg£n proyecto NFT? ya sea axie Infinity o similares;Positivo
Binance;¨Se puede comprar Criptomonedas con la tarjeta prepago Pagopar o billetera Tigo, personal?;Neutral
Cryptomonedas y un paraguayo viviendo en el extranjero. Situaci¢n legal ?;"Hola redditors. Como andan ?

Soy paraguayo viviendo en Europa hace unos a¤os ya, me fui de CDE hace 10 a¤os. Estoy de visita por el subreddit r/Paraguay  para saludar y sacarme unas dudas.

Yo tengo un poco de crypto ahorrado (no mucho) y pienso, cuando vuelva a Paraguay como podre hacer para poder convertir las criptomonedas en fiat (dinero tradiccional guaranies/dolares) ?

Cual es la situacion legal del cripto alla ? Es para como funciona la imposicion fiscal y cuando hay que pagar. Si tienen algun consejo les agredeceria.

&#x200B;

Gracias y saludos";Neutral
Cuando sos un rico pobre jaja hay que invertir en criptomonedas gente ??;(sin texto);Neutral
Forma efectiva de recibir dinero internacional?;Que formas conocen de recibir dinero aca en paraguay por trabajos online? Ya que paypal no permite cobrar, como uno puede hacer para cobrar dinero por trabajo freelance, servicios como twitch/youtube o inclusive por compra/venta/mineria de criptomonedas? A ver si conocen algun metodo para retirar, o en todo caso alguna vuelta para hacer llegar el dinero a una cuenta bancaria.;Neutral
Alguien tiene experiencia con Criptomomnedas?;"Buenas, hay alguna forma de recibir y enviar criptomonedas estando en Paraguay?

Basicamente me invitaron a una feria online para poder vender obras de arte y se realiza obviamente de manera online y el pago es mediante criptomonedas.

Alguna guia que pueda ver que me puede servir estando especificamente en Paraguay o algun dato relevante, todo es bienvenido, gracias!";Neutral
Banco Central de Paraguay Se¤ala que las Criptomonedas No Tienen Regulaci¢n en el Pa¡s;(sin texto);Neutral
Bancos de Paraguay cerrar n cuentas a un exchange de criptomonedas local;(sin texto);Neutral
2025 en 10 a¤os ahorros en Bancos o Ahorros en Bitcoin.?;"Si bien de aqu¡ a 10 a¤os el valor de la moneda se desvalorizara habr  obviamente siempre m s inflaci¢n.
Tienes alg£n plan de ahorro en un banco?
Piensan que eso es mejor que Comprar y Holdear (hodl) Bitcoin de ac  a 10 a¤os el futuro ser  bitcoin.
Les aconsejo que vayan comprando. En 2009 val¡a menos de un d¢lar hoy en d¡a es el boom ?? 
No olviden este post";Positivo
Encuentro Bitcoin en Encarnaci¢n.;"Hola a todos, me gustar¡a compartir con ustedes el encuentro bitcoin que se realizar  en Encarnaci¢n, del grupo Bitcoin Paraguayo.

>??? énete a nosotros para nuestra reuni¢n mensual de Bitcoin en Encarnaci¢n

>?? Fecha: Viernes, 13 de Diciembre  
?? Hora: 19:00 - 22:00  
?? Lugar: Galway Irish Pub ??

>Por favor reg¡strate aqu¡: [

>Habr  material informativo oficial de Bitcoin Paraguay para repartir. Se ayuda a configurar billetera Lightning, con sats de bienvenida ??";Positivo
Bitcoin;"Alguien que est‚ en el tema.??
Me gustar¡a comprar Criptomonedas de manera totalmente an¢nima y efectivisarlo a futuro.";Neutral
bitcoin;"no s‚ una chota de bitcoin, pero preciso abrirme una wallet. ¨qu‚ es lo b sico que debo saber? ¨alg£n consejo?

pd: para recibir pagos";Neutral
Paraguay y criptomonedas;"Me gustar¡a hablar sobre un tema un poco delicado: Cripto en Paraguay.

éltimamente, est  teniendo un boom en Paraguay, con varias noticias sobre proyectos de ley y con varios exchanges locales. Lo que s¡, quise probar y me fui a los tres m s ""grandes"" o m s renombrados: Cripex, Bitbase y X4T, adem s del P2P.


Cripex parece que ya ni existe, su sitio web no funciona y no se puede contactar a nadie.

En Bitbase quise comprar Bitcoin por 200.000Gs. Primero, me dijeron que necesitaba una wallet propia, cosa que no ten¡a. En la tienda venden algunas, pero cuestan m s de 100$ y son mucho m s caras que en Amazon y otros lugares. Un amigo m¡o tiene una wallet para recibir Bitcoin, as¡ que lo hicimos con su wallet. Y ah¡ vino la gran sorpresa:  
en una compra de 200.000Gs hubo una comisi¢n de 36.373Gs, ~18,37%. Adem s, nos dieron un tipo de cambio falso. El tipo de cambio oficial era 1BTC=213.251.786 en julio del a¤o pasado cuando compr‚. El tipo de cambio de Bitbase era 1BTC=274.857.417. Eso es una diferencia de casi el 28,89%. Si sumamos ambas ""comisiones"", Bitbase cobr¢ una comisi¢n de 47,26% sobre una compra de 200.000Gs, unos 94.520Gs. No me avisaron de estas comisiones antes y me siento estafado.

Despu‚s escuch‚ sobre X4T, una exchange nueva ac  en Paraguay. El registro fue r pido y tambi‚n te dan una wallet gratuita para recibir, enviar y comprar Cripto. Ah¡ tambi‚n podes comprar Cripto por efectivo o vender. Adem s, ofrecen transferencias bancarias y ahora una tarjeta de d‚bito, que para m¡ en lo personal es cara, pero para los que est n bien metidos en el mundo Cripto y valoran la anonimidad, les puede interesar. No hubo comisiones para el dep¢sito, solo cobran 2%-3% para retirar. El soporte es s£per £til y me explicaron todo lo importante como novato, adem s pude contactar al soporte v¡a WhatsApp para cualquier otra duda.

Mi amigo mencion¢ que siempre hace P2P. En este caso, te encuentras con un comprador/vendedor, seg£n lo que necesites, y podes cambiar cripto por efectivo. Se encuentran en la casa de alguien o en otro lugar y ah¡ hacen la transacci¢n. A ‚l le funciona bien, pero es un proceso incre¡blemente complicado para principiantes y adem s mucho mas caro. Los vendedores cobran entre 6%-15%, lo hacen de manera ilegal y todo el negocio se basa en ""confianza"".

Tengo curiosidad de ver hacia d¢nde va todo esto del Cripto y qu‚ dice nuestro gobierno. Personalmente, me gustar¡a que los bancos pierdan su monopolio y que Bancard no controle todas las finanzas del pa¡s.";Positivo
Paraguay proh¡be cripto. Debo vender mi Bitcoin antes de la nuevo ley o que? No quiero estar criminal. No soy minador, solo tengo un poco Bitcoin como inversion.;(sin texto);Neutral
Bitcoin comprar?;"A ustedes le aparece sugerencias de comprar Bitcoins?
As¡ como sol¡an anunciarlo hace 10 a¤os atr s?
Y que opinan?";Neutral
"Bitcoin en Paraguay; amigos que usan cripto en Paraguay ""no justamente como inversi¢n"" sino para hacer sus transacciones compra venta; mejorar aplicaciones para comprar, experiencias buenas/malas.?";(sin texto);Neutral
Bitcoin en Parawhy;Buenas a todos, estoy necesitando comprar Bitcoin (BTC), recientemente trate de hacerlo mediante Binance, pero por alguna raz¢n no me deja hacer el pago con mi tarjeta (Tengo una prepago Visa de Banco Atlas) y la verdad que es demasiado quilombo esto del Bitcoin y quisiera saber si alguien a lo mejor maneja alguna pagina o alguna manera de comprar y transferir BTC en este pais de mierda donde aparentemente todo luego es imposible a no ser que vendas tu culo a la pol¡tica la puta madre necesito ayuda.;Negativo
ahorrar con sueldo minimo;"Un tema bastante dif¡cil de encarar para algunos porque el sueldo es un tkk pero seguro que hay alguna manera de ahorrar y poder depositar en alguna cooperativa o banco con ahorro programado (no metan bitcoin porque es m s complejo solo ahorro) y bueno ser¡a interesante leer la opini¢n de algunos para ahorrar y tener alg£n fondo por si acaso. 


ALGUNA EXPERIENCIA CON BANCOS O COOPERATIVAS estar¡a interesante leer y sus m‚todos";Neutral
Como comprar Bitcoin en Paraguay?;Cu les son las opciones para comprar Bitcoin en Paraguay (cambiar PYG a BTC)?;Neutral
Cripto Moneda;Que saben de Cripex o de cripto Moneda en paraguay? Se puede operar y comprar Bitcoin/Ethereum?;Neutral
Que opciones pio hay para Bitcoin en Asunci¢n;"Buenas,

Que otras opciones hay a parte de Cripex para cambiar bitcoin ? Conocen algo?

edit: efectivizar bitcoin creo que ser¡a lo indicado";Neutral
BTC sugerencias;Buenas! alguien tiene experiencias de efectivizar bitcoin en PY?  Paypal es lo mas seguro pero como sabemos es imposible recibir en cuentas creadas en py, no se si es posible realizar transferencias a cuentas de Banco;Neutral
Crypto a Fiat en PY;"Buenas, desde hace 6 meses por ahi vengo minando ethereum ocasionalmente, la cuestion es de que no se como convertir ese dinero a FIAT sin pasar por traders (mala experiencia)
Tengo a mi disposicion tafjetas prepagas de Visa y Mastercard, hasta ahora en lo unico que pude usar el btc fue en giftcards amazon via bitrefill pero pegaria pagarse un asado con crypto jajaj

Pd. No es mucho, alrededor de 10usd - 20 usd semanales";Positivo
¨Qu‚ pas¢ ayer con UniSwap? No entiendo nada, ¨c¢mo es posible que regalaran d¢lares?;"**Buenas tardes, gente.**

B sicamente, lo que dice el t¡tulo. Me despert‚ esta ma¤ana con la noticia de que muchas personas ganaron entre 1200usd y 15000usd por haber hecho un par de transacciones con UniSwap.

No estoy muy metido en el mundo de las cryptos, lo £nico que conozco es Bitcoin y Ethereum, con las cuales nunca oper‚. Imaginense que no ten¡a idea de que existiera UniSwap.

Bueno, el tema es el siguiente, durante todo el d¡a me llegaron posts en Facebook e Instagram de TronLink Pro, otra Crypto. En donde supuestamente hay que registrarse y te dan cr‚ditos.

¨Qu‚ onda con esto? ¨Ustedes creen que puedan llegar valer algo esos cr‚ditos en unos meses? ¨Es seguro registrarse? ¨O te roban los datos?

**El mensaje siempre es el mismo:**

>""Si aprovechaste la oportunidad de los 400 UNI de UniSwap, hay otro Airdrop prometedor, TronLink Pro. Te dan 300 cr‚ditos con s¢lo registrarte.  
Paso 1: Descargar TronLink Pro en la app store.  
Paso 2: Crear una cuenta  
Paso 3: Luego de crear la cuenta, selecciona ""Me"" en el panel inferior.  
Paso 4: Seleccionar Invite a Friend  
Paso 5: Selecciona Claim Rewards e introduce el c¢digo 9Fbs y recibiras los 300 cr‚ditos.  
Los cuales podr¡an valer 50usd, 100usd o 500usd. As¡ sean 100usd, ya es ganancia por s¢lo dos minutos que te toma registrarte.""

No se, me parece sospechoso. Pero, por otro lado, me sentir¡a medio tonto si me entero en unos meses que esos ""cr‚ditos"" ten¡an valor....

Gracias, gente!";Neutral
Cryptocurrency exchange en Paraguay?;Existen exchanges de crypto en Paraguay? Para comprar y vender BTC por guaran¡ o d¢lares?;Neutral
Alguien que haya minado con el Antminer S19;"Estoy interesado en comprar el Antminer S19 y quisiera saber que tengo que tener en cuenta al momento de comprar y utilizar la m quina 
Que piscinas de miner¡a me recomiendan y como realizar las transferencias. Les agradecer¡a su ayuda y opini¢n.";Neutral
¨C¢mo retirar BTC de miner¡a de manera legal?;"Tengo ahorrado una cantidad de BTC en mi cuenta de Binance que acumul‚ haciendo miner¡a de cripto. S‚ que existe la posibilidad de retirarlo con p2p, as¡ que recibo una transferencia en guaranies en mi banco de alguna persona.

Mi pregunta es si voy a tener problemas por recibir una transferencia random de una persona en mi cuenta (supongamos 10 millones) y como se debe declarar eso legalmente y si se debe pagar IRP o hacer factura por el monto.

¨Alguien sabe o tiene experiencia?";Neutral
Ideas para ingresos pasivos en PY?;Digamos que por motivos de formaci¢n acad‚mica no puedo trabajar, solo estudiar, alguien sabe en que puedo invertir que me genere ingresos pasivos algo asi como la miner¡a de criptomonedas.;Neutral
PC Gamer y presupuesto;"Los perros, estoy queriendo comprarme una PC usada, no quiero armar una por los exhuberantes precios actuales, tengo un conocimiento muy b sico de PCs, se que son cada componentes y para que sirven pero no te podr¡a diferenciar cual es por ejemplo el que m s me conviene, mis objetivos claros son poder jugar en al menos 2K los juegos en general, hablando de juegos actuales obviamente, a unos fps superiores a 60 (+100 ideales) en juegos mas competitivos, con todo esto vienen mis preguntas
1 - ¨Me conviene comprar una PC usada que no haya sido usada para miner¡a? ¨O igual con los precios actuales es mejor armar una desde cero?
2 - Excluyendo perif‚ricos ¨Cuanto deber¡a de ahorrar para esto?
3 - ¨Que deber¡a de estar buscando?, hablando de cosas m s caras como tarjetas gr ficas o procesadores";Neutral
Busco consejos para mudarme e iniciar mi negocio en Paraguay;"Hola, soy de Brasil y estoy buscando mudarme y empezar un negocio en Paraguay.

Tengo muchas dudas sobre los tipos de empresa, pero me parece que SA es el adecuado, tengo la intenci¢n de abrir un negocio de miner¡a cryptocurrency donde voy a ser el £nico empleado.

Tambi‚n tengo la intenci¢n de vivir en Paraguay, pero tengo muchas dudas acerca de los documentos que necesito obtener, la apertura de un banco en Paraguay y la burocracia que implica la apertura de la empresa. Lo m s f cil para m¡ es viajar a Paraguay....

­Cualquier sugerencia o consejo que me ayude en mi viaje ser  muy apreciado!

Gracias!";Neutral
Cryto;Que piensan de la miner¡a de criptomonedas en Paraguay, es rentable?;Neutral
Alguien sabe d¢nde puedo conseguir una 3070ti no muy cara;Creo que el m s barato que v¡ fue 4 millones pero era usado (y no s‚ si para miner¡a), y uno nuevo lo m s barato que v¡ fue en Nissei a 6 palitos por ah¡, por si alguien sepa de m s lugares;Neutral
Trabajo para una grande empresa de miner¡a de criptomonedas en Paraguay, hagan sus preguntas.;Responder‚ todo lo que no sea de car cter personal o confidencial, come on!;Neutral
Proyecto Yuty de Extracci¢n de Uranio;"

¨Que opinan?
Edit : Hay otra cosa que sale en otro comunicado de la empresa, reportan la mayor reserva de titanio del mundo entero, tremenda noticia. Hace tiempo que se sabe que hay un potencial alto en el area de miner¡a, veremos que que hacen al respecto.
El de Titanio se llama Project Alto Parana
 Edit : Correcci¢n Oviedo es de Uranio tambien";Neutral
Ley de Miner¡a en Py;"Se aprob¢ la ley de miner¡a en Paraguay, lo que convierte a esa actividad en una fuente gravada y regulada por el estado.

Obviamente la ley no da ninguna ventaja a los mineros, pero me pregunto si eso dejar  la puerta abierta a que se empiecen a aceptar las criptomonedas como medio de pago.

Esta apertura, beneficiar  o perjudicar  al minero y a la sociedad? Ya que el senador Buzarquis est  promoviendo el minado de BTC como si fuera la panacea a todos los males.



Saludos!";Neutral
Miner¡a de criptos en Paraguay;Buenas, adem s de Cripex, conocen a alguien que mine criptos?;Neutral
Peli de Minecraft:(;"Buenas gente, estoy al pedo, no puedo dormir y no se porque se me ocurri¢ contar esto.. tambi‚n se que a nadie le importa pero no s‚, no tengo a nadie con qui‚n compartir esto. 
 Hace unos pocos meses termine con mi novia y dentro de todo quedamos en buenos t‚rminos, la verdad es que ya no nos est bamos entendiendo tanto, adem s ella tuvo que irse a otro lugar por cuestiones de avanzar y tal pero nos prometimos seguir fuertes y siempre juntos y despu‚s de hablarlo y hacerlo todo doloroso solo decid¡ dejarla volar, que ella se merec¡a m s, y bueno, no voy a negar que que la extra¤o todos los d¡as, que le amo demasiado, que dar¡a cualquier cosa por volver el tiempo atr s a vivir todos los momentos buenos  y malos, la verdad es que solo quiero estar con ella, no se, siento que se fu‚ una parte de mi para siempre, en fin, duramos 5 a¤os con 7 meses y cerca de 1 a distancia, la cosa es que estos d¡as se estren¢ la pel¡cula de Minecraft y me invitaron varios amigos a ver pero no puedo, porque me recuerda much¡simo a ella, yo recuerdo que odiaba ese juego y no le daba nada de chances hasta que empezamos la relaci¢n y ella fue la que me ense¤¢ todo y yo obvio acepte porque me encantaba compartir con ella todo lo que le gustaba y le hac¡a feliz, entonces acced¡ a jugar y me encant¢ todo, me pas‚ a¤os jugando con ella, lo t¡pico, nuestro mundito, nuestra casita, nuestros gatitos, sus decoraciones, minar juntos y no se, siento que si voy a ver la peli me voy a quebrar jajaja y tampoco quiero volver a jugar pq las musiquitas me van a causar lo mismo y tampoco es igual jugar sin ella, no se, estoy tan triste y sin ganas de nada, yo planee la vida con esa mujer y me duele recordarle todos los d¡as, en fin, era esa macanada, que est‚n bien gente!";Neutral
Ayuda con Asics de mineria crypto;"Hola gente, estoy interesado en adecuar mi local para minar btc, ya tengo las maquinas pero resulta que son demasiado ruidosas, alguien sabe o maneja alguna forma de silenciarlas sin que se calienten?
Ya les puse dentro de una estructura de paneles termoacusticos y espuma anti sonora, pero igual suenan fuertisimo";Neutral
Minerar Cripto en Paraguay;Quiero consultarles si alguien sabe que se necesita, documento, patentes, etc. Para minar en Paraguay tambien si se puede hacer en una casa particular y tiener todo legal con el permiso de la ande, te pueden crear problemas igual, en conclusi¢n yo quiero comprar un transformador de 150KVA, pedir permiso en la ande, pagar el consum¢ que sea y colocar en una casa (que no es mi casa, ejemplo una casa alquilada) y mi duda es si me puede venir la fiscalia o alguna entidad reguladora entonces les pregunto si saben algo al respecto.;Neutral
Minar cripto py;Hola gente, hay algun entendido sobre como minar cripto de forma correcta?, o si saben de alguien que lo haga de forma segura? sobre los precios de sistema, equipos, refrigeracion, incluso precios de consumo electrico?? Es rentable siquiera? ??;Neutral
Es legal minar bitcoin en Paraguay?;S‚ que hace poco rechazaron la regulaci¢n pero se puede minar igual? Vivo en el extranjero y estoy interesado en la idea de realizar esto en Paraguay.;Neutral
mineria de criptomonedas;"Buenas tardes gente quisiera saber como podria minar cripto desde casa, cuanto es la capital o fondo minimo que necesito para empezar y si vale la pena, tambien me interesaria saber alguna sugerencia acerca de que cripto podria minar, ya que £ltimamente me empezo a interesar el tema por que lei que el costo de electricidad de este pais es ""bajo"" en relaci¢n a los otros pa¡ses donde mas bitcoins se mina";Neutral
