titulo;cuerpo;sentimiento
Trading en Tiktok;Que onda derrepente cada vairo que ofrece su curso, antes co el novio de la onichan nms era pesado pero ahora se reproducieron   Hasta ese man que hac¡a tiktok de macanadas en el mercado 4 co hace TRADING, despu‚s esta ese Aquino que con un cripto cada tanto gua?u efectivizar y para colmo tiene gente boba que comenta toda la hora brooo l¡der espectacular quiero entrar al curso???? tenes que irte de viaje tambi‚n a dubai vos l¡der ??????, se est n volviendo peor que los colorados;Negativo
Percibir salario desde trabajo remoto;"Hola, el pr¢ximo mes empezar‚ a trabajar remoto para una multinacional extranjera. Puedo cobrar en USD o en cripto... Ustedes que todo lo saben... ¨Cu l es la mejor opci¢n?
Si es en USD, ¨qu‚ bancos recomiendan y por qu‚?  
Si es en cripto, ¨qu‚ billeteras recomiendan y por qu‚?
  ¨Ser¡a buena idea cobrar una parte en USD y el resto en cripto? Compartan su experiencia /tips";Neutral
Apple gift cards;"Tengo 400$ en Apple gift cards y quiero vender. Ya sea transferencia o cripto. 
Vendo 100$ de gift cards por 95$";Neutral
Recibir pagos del exterior sin tener problemas con Set;Como paraguayo cual es la manera m s simple de cobrar por trabajos que sea compatible freelancer y fiverr? Sin tener que hacer jugadas de convertir la plata a cripto, luego a euros y luego a guaran¡es?;Neutral
Tarjetas de credito cobrando en cripto;Alguien sabe si hay alguna forma de que ciertos bancos me habiliten tarjetas de credito si cobro en cripto?  Trabajo para una empresa de afuera y cobro en dolares, para ahorrarme gastos cobro en cripto pero ulltimamente estoy queriendo quitar tarjetas de credito y no se como poder blanquear eso, consejos?;Neutral
Estar¡a interesante conocer personas que esten metidas en el mundo cripto y el trading para intercambiar palabras, escriban!!;(sin texto);Neutral
Hay alguna forma pr ctica de cambiar cripto a Gs. para no residentes?;"O sea, para alguien que no tenga cuenta bancaria all . 

Hay alg£n m‚todo confiable y que no te maten con la comisi¢n?";Neutral
Ganar plata en Paraguay siendo joven y con poco capital;"Buenas, tengo 20 a¤os y soy de Asuncion, estoy actualmente estudiando ing. informatica y estoy queriendo invertir en algo que no requiera mucha inversion, algun emprendimiento, actualmente tengo un trabajo pero pagan menos que el minimo y me cansa y deseo tener una forma mejor, mas flexible y que pueda hacerme me plata y estoy viendo opciones.

Entre las cosas que ya probe esta el trading y lo relacionado a cripto, es rentable pero no tanto, y muy facil de perder lo que ganaste si haces algo mal, lo que si estuve pensando en algun tipo negocio de aplicacion de herramientas(o creacion de estas) de IA a negocios, enfocandose en peque¤as y medianas empresas, o tambien alguna tienda online para venta de productos al por mayor(mas para que empresarios compren sus productos de ahi, una especie de alibaba), o algo de servicios de marketing pero no se la demanda que estas pueden tener y no quiero inevrtir mucho tiempo en algo que no me vaya a servir en nada luego, que recomiendan o que ideas dicen pueda probar? tambien estaria bueno si dicen alguna app que les gustaria tener en su tel o un servicio que no haya o haya poco en el pais.";Neutral
Paraguay y criptomonedas;"Me gustar¡a hablar sobre un tema un poco delicado: Cripto en Paraguay.

éltimamente, est  teniendo un boom en Paraguay, con varias noticias sobre proyectos de ley y con varios exchanges locales. Lo que s¡, quise probar y me fui a los tres m s ""grandes"" o m s renombrados: Cripex, Bitbase y X4T, adem s del P2P.


Cripex parece que ya ni existe, su sitio web no funciona y no se puede contactar a nadie.

En Bitbase quise comprar Bitcoin por 200.000Gs. Primero, me dijeron que necesitaba una wallet propia, cosa que no ten¡a. En la tienda venden algunas, pero cuestan m s de 100$ y son mucho m s caras que en Amazon y otros lugares. Un amigo m¡o tiene una wallet para recibir Bitcoin, as¡ que lo hicimos con su wallet. Y ah¡ vino la gran sorpresa:  
en una compra de 200.000Gs hubo una comisi¢n de 36.373Gs, ~18,37%. Adem s, nos dieron un tipo de cambio falso. El tipo de cambio oficial era 1BTC=213.251.786 en julio del a¤o pasado cuando compr‚. El tipo de cambio de Bitbase era 1BTC=274.857.417. Eso es una diferencia de casi el 28,89%. Si sumamos ambas ""comisiones"", Bitbase cobr¢ una comisi¢n de 47,26% sobre una compra de 200.000Gs, unos 94.520Gs. No me avisaron de estas comisiones antes y me siento estafado.

Despu‚s escuch‚ sobre X4T, una exchange nueva ac  en Paraguay. El registro fue r pido y tambi‚n te dan una wallet gratuita para recibir, enviar y comprar Cripto. Ah¡ tambi‚n podes comprar Cripto por efectivo o vender. Adem s, ofrecen transferencias bancarias y ahora una tarjeta de d‚bito, que para m¡ en lo personal es cara, pero para los que est n bien metidos en el mundo Cripto y valoran la anonimidad, les puede interesar. No hubo comisiones para el dep¢sito, solo cobran 2%-3% para retirar. El soporte es s£per £til y me explicaron todo lo importante como novato, adem s pude contactar al soporte v¡a WhatsApp para cualquier otra duda.

Mi amigo mencion¢ que siempre hace P2P. En este caso, te encuentras con un comprador/vendedor, seg£n lo que necesites, y podes cambiar cripto por efectivo. Se encuentran en la casa de alguien o en otro lugar y ah¡ hacen la transacci¢n. A ‚l le funciona bien, pero es un proceso incre¡blemente complicado para principiantes y adem s mucho mas caro. Los vendedores cobran entre 6%-15%, lo hacen de manera ilegal y todo el negocio se basa en ""confianza"".

Tengo curiosidad de ver hacia d¢nde va todo esto del Cripto y qu‚ dice nuestro gobierno. Personalmente, me gustar¡a que los bancos pierdan su monopolio y que Bancard no controle todas las finanzas del pa¡s.";Negativo
Paraguay proh¡be cripto. Debo vender mi Bitcoin antes de la nuevo ley o que? No quiero estar criminal. No soy minador, solo tengo un poco Bitcoin como inversion.;(sin texto);Negativo
¨C¢mo retirar BTC de miner¡a de manera legal?;"Tengo ahorrado una cantidad de BTC en mi cuenta de Binance que acumul‚ haciendo miner¡a de cripto. S‚ que existe la posibilidad de retirarlo con p2p, as¡ que recibo una transferencia en guaranies en mi banco de alguna persona.

Mi pregunta es si voy a tener problemas por recibir una transferencia random de una persona en mi cuenta (supongamos 10 millones) y como se debe declarar eso legalmente y si se debe pagar IRP o hacer factura por el monto.

¨Alguien sabe o tiene experiencia?";Neutral
World app;Gente alguien sabe como se canjea esta cosa en varias redes sociales suelo ver gente canjeando esa cripto alguien sabe como funciona;Neutral
Minerar Cripto en Paraguay;Quiero consultarles si alguien sabe que se necesita, documento, patentes, etc. Para minar en Paraguay tambien si se puede hacer en una casa particular y tiener todo legal con el permiso de la ande, te pueden crear problemas igual, en conclusi¢n yo quiero comprar un transformador de 150KVA, pedir permiso en la ande, pagar el consum¢ que sea y colocar en una casa (que no es mi casa, ejemplo una casa alquilada) y mi duda es si me puede venir la fiscalia o alguna entidad reguladora entonces les pregunto si saben algo al respecto.;Neutral
Turbio?;"Brock Pierce , magnate de cripto,  vinculado presuntamente a un circulo de  pedofilia en Hollywood en los a¤os 2000 junto con el director Bryan singer y Marc Collins - Rector ; se re£ne con el ministro de tecnolog¡a, tambi‚n con el  ministro de industria y comercio  con la idea de "" impulsar la tecnologia"" en paraguay. Un poco raro que hagan negocios con este tipo  considerando que en paraguay abundan los casos de pedofilia. 



 Que piensan ?  Les dejo unos v¡deos/documentales que profundizan m s sobre el tema.";Negativo
Minar cripto py;Hola gente, hay algun entendido sobre como minar cripto de forma correcta?, o si saben de alguien que lo haga de forma segura? sobre los precios de sistema, equipos, refrigeracion, incluso precios de consumo electrico?? Es rentable siquiera? ??;Neutral
Consulta;"Para mis amigos traders de este pais y gente que conozca del tema; quiero hacerles una consulta. 

Ustedes tienen problemas para comprar cripto con la tarjeta Pagopar Vision en Binance? Mand‚ renovar mi tarjeta porque se hab¡a vencido y ahora no puedo comprar en Binance. Me sale un mensaje que la tarjeta no esta habilitado para compras internacionales. Pero con la misma tarjeta uso para pagar Spotify, por ejemplo. Si a alguien le pasa lo mismo y tiene una soluci¢n, pol favol... Compaltan!";Neutral
GANAR DINERO EXTRA;C£al creen que sea un m‚todo escalable de ganar en Paraguay? Que tipo de emprendimiento creen que se puede empezar desde poco dinero y escalar de una buena manera? Alguien que entienda m s a fondo? Me gustar¡a poner a trabajar el poco dinero que tengo ahorrado, pero los intereses del banco generan muy poco y no pueden con la inflaci¢n. No les pido que cuenten sus secretos de como ganar dinero, si no algunos tips o metodos para Sobresalir. Me interesa mucho el tema de invertir, pero no me interesa todo lo que sea cripto y esas cosas piramidales de internet. Espero que los comentarios tambien le sirvan a otras personas que est n en la misma situaci¢n. Actualmente estoy trabajando pero no me alcanza, me gustaria ganar dinero de otras fuentes. Les leo y de antemano agradezco;Neutral
Compras online desde Argentina;"Hola!, creo este post para consultar si alguien sabe como comprar desde Argentina en los sitios web de Paraguay como nissei, chinashopping, megaelectronicos, mobilezone, etc y no morir en el intento. Cuento solo con cripto y las tarjetas que tengo no tienen el l¡mite que necesito, lo que est  haciendo que se convierta en un gran dolor de cabeza.

La idea es comprar las cosas por mi parte y enviar todo a lo de un amigo para que me lo traiga a Argentina.

Opciones que encontr‚:  
Lemon cash, vi que los montos de operaciones son altas y los l¡mites de compra son muy bajos, necesito por lo menos poder contar con montos de 4 playstation 5.

Tarjeta binance, no encontr‚ l¡mites de compra y no s‚ si es posible usarla en el pa¡s.

Me ofrecieron una persona que puede ir a comprar, pagar en moneda local, retirar y entregar al domicilio que necesito pero con un costo elevado en dolares por cada comercio.

Otra alternativa que me ofrecieron ser¡a con un servicio de ""shop for me"" que, pese al honorario adicional en dolares, resulta la mejor opci¢n hasta ahora.

Si alguien tiene info al respecto se lo agradecer¡a.";Neutral
Tengo 15 millones;Que negocios m s o menos recomiendan con esa cantidad de capital... Nada que sea cripto o pir mides;Negativo
Ingreso segundario en paraguay;"Buenas tardes para todos, me podrian ayudar con una idea de ingreso segundario en Paraguay?.

Estoy buscando generar otro ingreso a parte del que ya tengo(trabajo en una empresa), busco uno fisico que no sea tipo inversion digital o algo de cripto y demas. Sino uno fisico, venta de productos o algun negocio.

Si alguien tiene experiencia en eso y me pueda ayuar porfa

Gracias !";Neutral
Billetera cripto: gente, evidentemente dejar criptomonedas en exchanges est  visto que no es seguro (sobre todo al ver lo de FTX). Que Wallet recomiendan? Que sea segura sin que sea una cold Wallet?;(sin texto);Negativo
mineria de criptomonedas;"Buenas tardes gente quisiera saber como podria minar cripto desde casa, cuanto es la capital o fondo minimo que necesito para empezar y si vale la pena, tambien me interesaria saber alguna sugerencia acerca de que cripto podria minar, ya que £ltimamente me empezo a interesar el tema por que lei que el costo de electricidad de este pais es ""bajo"" en relaci¢n a los otros pa¡ses donde mas bitcoins se mina";Neutral
"Bitcoin en Paraguay; amigos que usan cripto en Paraguay ""no justamente como inversi¢n"" sino para hacer sus transacciones compra venta; mejorar aplicaciones para comprar, experiencias buenas/malas.?";(sin texto);Neutral
Ingresar dinero de venta de criptomonedas en la banca paraguaya;Hola, ¨alguien se maneja en cripto por aqu¡?. Me consta que en Paraguay la ley permite cambiar criptomonedas por dinero de curso legal y por bienes y servicios pero a la vez los bancos parece que no aceptan dinero proveniente de esas actividades. ¨Alguien conoce qu‚ formas usan los inversores cripto para meter su dinero en el banco?;Neutral
Cryptomonedas y un paraguayo viviendo en el extranjero. Situaci¢n legal ?;"Hola redditors. Como andan ?

Soy paraguayo viviendo en Europa hace unos a¤os ya, me fui de CDE hace 10 a¤os. Estoy de visita por el subreddit r/Paraguay  para saludar y sacarme unas dudas.

Yo tengo un poco de crypto ahorrado (no mucho) y pienso, cuando vuelva a Paraguay como podre hacer para poder convertir las criptomonedas en fiat (dinero tradiccional guaranies/dolares) ?

Cual es la situacion legal del cripto alla ? Es para como funciona la imposicion fiscal y cuando hay que pagar. Si tienen algun consejo les agredeceria.

&#x200B;

Gracias y saludos";Neutral
¨Alguna forma de depositar d¢lares en alg£n banco sin pagar comisiones por dep¢sito?;"Hasta ahora s‚ que se pueden hacer transferencias de una cuenta de d¢lares a otra en d¢lares sin comisiones. La otra forma que s‚ es haciendo una transferencia SWIFT a un banco extranjero (pagando en efectivo) y luego mandando el dinero a PY de nuevo, pero solamente funciona con cantidades muy grandes de dinero, ya que igual cobran comisiones por env¡o y dep¢sito.

Si saben alguna forma para transformar d¢lares en efectivo directo a cripto tambi‚n sirve.";Neutral
Ganar cripto f cil? Lee esto!;(sin texto);Neutral
PayPal, crypto u otros;"Buenas. Tengo el siguiente problema. Empec‚ a trabajar online, en una plataforma que se llama Cambly. El tema es que solo pagan por PayPal. Tengo cuenta, pero entiendo que no podr‚ retirar la plata ac  en Paraguay. Estoy viendo maneras para poder efectivizar lo que gano. Las dos opciones que tengo creo que son comprar cripto monedas con lo que me pagan a paypal, o abrir una empresa en Estonia, y de ahi poder hacerme transferencias bancarias.

&#x200B;

Hay alguna otra opcion? Estuve investigando tambien TransferWise, Neteller y Payoneer";
Cripto Moneda;Que saben de Cripex o de cripto Moneda en paraguay? Se puede operar y comprar Bitcoin/Ethereum?;Neutral
$$;**Alguien que invierta en la Bolsa?? que no sea Cripto.**;Neutral
Ayuda con ciberseguridad;Buenas, hace dos semanas recibi un correo (21/4) el mismo fue enviado desde mi cuenta de microsoft y estaba entre correos no deseadsos, lo abro hoy y es un mensaje diciendo estar infectado con pegasus y para pasar cierto monto en criptomonedas, adem s de que el mensaje ser¡a notificado una vez abierto (hoy), no tengo mucha seguridad con el mismo y quisiera saber si alguno podr¡a dar una mano con eso, hay forma de identificar la veracidad de este?;Neutral
Criptomonedas.;Buenas gente, alguien sabe desde que plataforma puedo efectivizar bitcoins en paraguay para hacer el retiro desde mi cuenta bancaria?.;Negativo
Que opinan del trading?;Les p rese una estafa el tema del trading? Yo planeo invertir 10 d¢lares alprincipio para ir probando y una ves que me valla bien invertir cantidades ya m s altas, el broker que utilizar‚ ser  binance y ser  el trading de criptomonedas, que opinan...;Neutral
Mineria ¨ilegal?;"Acabo de ver un posteo en X de la Fiscalia jactandose de un procedimiento por haber descubierto una granja de mineria ""clandestina"" de criptomonedas. 

Que yo sepa no es una actividad regulada, ¨cual es la ""clandestinidad"" de una actividad de ambito provado en una propiedad privada que no esta prohibida por ley?

Se me ocurre que la conexion electrica puede ser clandestina (suelen recurrir a eso los cachafas porque se consume mucha energia electrica) aun asi no es motivo suficiente para ingresar a tu propiedad e incautar equipos, las conexiones clandestinas son un delito de accion penal privada, la ANDE debe documentar y demandar. 

Me llama la atencion que nadie conoce sus derechos y la gente en general no sabe diferenciar estas cosas. 

¨Que aprendieron en la escuela?";Negativo
C¢mo hacen para cobrar en USDT o criptomonedas sus trabajos? y en que plataformas o apps lo hacen? Fiverr y upwork no tienen esas opciones;(sin texto);Neutral
Crypto;Quiero iniciarme en el mundo de las criptomonedas, alg£n curso gratuito que recomiendan? Mi conocimiento acerca del tema es pr cticamente nulo, me gustar¡a aprender a comprar cryptos, pagar, transferir, etc.;Neutral
Estadounidense buscando hacer amigos en Paraguay;"­Hola otra vez m s! Soy estadounidense y estoy planeando mudarme a Paraguay. Me gustar¡a hacer amigos locales, pero tengo algunas reservas al respecto. He notado que muchos de los expatriados en Paraguay son personas vinculadas al mundo de las criptomonedas, antivacunas, teor¡as conspirativas, y evasi¢n de impuestos. Honestamente, no es mi tipo de gente, y no me atrae mucho ese ambiente. Tambi‚n he visto que muchos llevan vidas bastante lujosas y no suelen mezclarse con personas fuera de su clase social o econ¢mica. Yo, por el contrario, llevo una vida m s modesta, sin lujos, y mi objetivo es conectar con paraguayos de clase trabajadora y clase media.

Quiero agregar que, en mi experiencia viviendo en otros pa¡ses de Am‚rica Latina, ha sido realmente dif¡cil hacer amigos, especialmente en culturas m s conservadoras, por el simple hecho de ser extranjero. Donde vivo ahora, la gente es amable, pero nadie se acerca lo suficiente para llegar a ser amigos. La mayor¡a de las personas con las que interact£o se sienten inc¢modas por el hecho de que soy extranjero, son muy penosas, y asumen que voy a sentir desprecio por su estilo de vida, que los mirar‚ de menos o que de alguna manera los humillar‚.

Entiendo y reconozco la validez de sus reservas, pero nunca mirar¡a a alguien de menos por tener menos recursos econ¢micos, educaci¢n, posesiones, etc. No me siento como alguien ""fresa"" como dicen los mejicanos o ""cuico"" como dicen los chilenos. Me siento igualmente c¢modo en una casa con cer mica y aire acondicionado como en una con piso de tierra y poco m s. Los £nicos que realmente han sido acogedores hasta ahora han sido los evang‚licos, y aunque muchos de ellos son buena gente, no soy religioso ni me interesa hablar de todos los temas a trav‚s de la lente del cristianismo.

Mi pregunta es, ¨estoy a punto de enfrentarme a una situaci¢n similar en Paraguay, o existe la posibilidad de hacer amigos en lugares fuera de Asunci¢n, como Paraguar¡ o Caacup‚? ¨Es probable que pueda encontrar personas con intereses similares a los m¡os en estas  reas, o en Asunci¢n tambi‚n, que no tendr¡an pena por conocerme? ¨D¢nde los puedo encontrar?

Me gustar¡a conocer gente que disfrute de leer una buena novela, estudiar historia por diversi¢n, discutir pol¡tica y temas sociales, contribuir de manera desinteresada a su comunidad, pasar tiempo en la naturaleza, el arte, la m£sica, etc. En resumen, busco conectar con personas aut‚nticas que valoren las cosas sencillas de la vida. 

S‚ que abundan ese tipo de gente en nuestro mundo, solo quiero saber d¢nde los puedo encontrar en Paraguay y si existen algunos que no tendr¡an pena de conocer un gringito como yo jaja!

­Gracias de antemano por cualquier consejo o recomendaci¢n que puedan compartir!";Neutral
Bitcoin;"Alguien que est‚ en el tema.??
Me gustar¡a comprar Criptomonedas de manera totalmente an¢nima y efectivisarlo a futuro.";Neutral
Dinero del extranjero;Despu‚s de leer varios posts, la mejor opci¢n para retirar dinero del extranjero ser¡a por medio de criptomonedas? Pero luego c¢mo pasar las criptos a guaran¡es alguien sabe??;Neutral
La ANDE £ltimamente anda incautando muchas m quinas de Criptomonedas. la gente es muy evidente o como cre‚n que son descubiertos?;(sin texto);Neutral
D¢nde cambiar criptomonedas a d¢lares o guaran¡es en Paraguay?;Experiencias usando criptomonedas en Paraguay;Neutral
Pagar con criptomonedas en comercios o lugares gastron¢micos en Paraguay;Alguna experiencia de locales comerciales que acepten criptomonedas en Paraguay?;Neutral
Paraguay y criptomonedas;"Me gustar¡a hablar sobre un tema un poco delicado: Cripto en Paraguay.

éltimamente, est  teniendo un boom en Paraguay, con varias noticias sobre proyectos de ley y con varios exchanges locales. Lo que s¡, quise probar y me fui a los tres m s ""grandes"" o m s renombrados: Cripex, Bitbase y X4T, adem s del P2P.


Cripex parece que ya ni existe, su sitio web no funciona y no se puede contactar a nadie.

En Bitbase quise comprar Bitcoin por 200.000Gs. Primero, me dijeron que necesitaba una wallet propia, cosa que no ten¡a. En la tienda venden algunas, pero cuestan m s de 100$ y son mucho m s caras que en Amazon y otros lugares. Un amigo m¡o tiene una wallet para recibir Bitcoin, as¡ que lo hicimos con su wallet. Y ah¡ vino la gran sorpresa:  
en una compra de 200.000Gs hubo una comisi¢n de 36.373Gs, ~18,37%. Adem s, nos dieron un tipo de cambio falso. El tipo de cambio oficial era 1BTC=213.251.786 en julio del a¤o pasado cuando compr‚. El tipo de cambio de Bitbase era 1BTC=274.857.417. Eso es una diferencia de casi el 28,89%. Si sumamos ambas ""comisiones"", Bitbase cobr¢ una comisi¢n de 47,26% sobre una compra de 200.000Gs, unos 94.520Gs. No me avisaron de estas comisiones antes y me siento estafado.

Despu‚s escuch‚ sobre X4T, una exchange nueva ac  en Paraguay. El registro fue r pido y tambi‚n te dan una wallet gratuita para recibir, enviar y comprar Cripto. Ah¡ tambi‚n podes comprar Cripto por efectivo o vender. Adem s, ofrecen transferencias bancarias y ahora una tarjeta de d‚bito, que para m¡ en lo personal es cara, pero para los que est n bien metidos en el mundo Cripto y valoran la anonimidad, les puede interesar. No hubo comisiones para el dep¢sito, solo cobran 2%-3% para retirar. El soporte es s£per £til y me explicaron todo lo importante como novato, adem s pude contactar al soporte v¡a WhatsApp para cualquier otra duda.

Mi amigo mencion¢ que siempre hace P2P. En este caso, te encuentras con un comprador/vendedor, seg£n lo que necesites, y podes cambiar cripto por efectivo. Se encuentran en la casa de alguien o en otro lugar y ah¡ hacen la transacci¢n. A ‚l le funciona bien, pero es un proceso incre¡blemente complicado para principiantes y adem s mucho mas caro. Los vendedores cobran entre 6%-15%, lo hacen de manera ilegal y todo el negocio se basa en ""confianza"".

Tengo curiosidad de ver hacia d¢nde va todo esto del Cripto y qu‚ dice nuestro gobierno. Personalmente, me gustar¡a que los bancos pierdan su monopolio y que Bancard no controle todas las finanzas del pa¡s.";Positivo
Comprar auto al contado;"Hola! Quisiera saber si se puede realizar la compra de un auto al contado en efectivo, y si piden origen de fondos, trabajo para el exterior y cobro en criptomonedas y me seria un poco complicado justificar, existe un monto m ximo? O que recomiendan.

No se si solamente mi contrato con la empresa serviria para justificar los fondos?";Neutral
Hay alguna forma de trabajar con binance desde Py;Veo que hay restricciones para poder operar o hacer traspaso de dinero mediante banco a Internet mediante p ginas de criptomonedas o traiding;Neutral
CDE D¢nde hay locales f¡sicos de Exchange de criptomonedas (DAI, Thether) a Guaran¡es/USD;(sin texto);Neutral
Independizacion? en Paraguay?;"Me graduo en 2024 y busco independizarme de mis padres. Que tan factible es? Cuales serian unos pasos o tips para poder independizarme?

La idea que tengo primero es; conseguir un laburo, conseguir un auto. Hacer uber despues de salir del trabajo. Juntar plata y despues buscar un depto que no sea tan caro, mudarme al depto con un colchon y de ahi crecer de a poco. 

Buscando online veo gente que dice de conseguir un ingreso pasivo y esas cosas pero realmente eso no funciona en paraguay. Si para mantenerme el dia a dia ya utilizo todos mis ingresos, como es posible un ingreso pasivo? Nada de inversiones y criptomonedas y esas macanadas. 

Como se independizaron? Es realmente cara la renta en asuncion? o debo ir a luque/mariano/fernando de la mora?";Negativo
Ideas para ingresos pasivos en PY?;Digamos que por motivos de formaci¢n acad‚mica no puedo trabajar, solo estudiar, alguien sabe en que puedo invertir que me genere ingresos pasivos algo asi como la miner¡a de criptomonedas.;Positivo
CRIPTOMONEDAS EN PARAGUAY;Buenas muchachos, como est n?. Quisiera saber si alguno de ustedes tiene experiencia comprando CRIPTOMONEDAS y/o grupos donde pueda unirme para aprender m s acerca de eso, lo quiero hacer como un hobbie porque me llama mucho la atenci¢n, el otro d¡a compr‚ una DOGECOIN por menos de un centavo de d¢lar, y quiero de a poco ir aprendiendo m s acerca de c¢mo ganar plata con eso, cualquier ayuda se agradece.;Positivo
Criptomonedas;Conocen alguien que compre criptos? A cambio de d¢lares o guaran¡es? O alguna casa de cambio exclusivo de criptos. Cualquier info me vendr¡a bien;Neutral
Cryto;Que piensan de la miner¡a de criptomonedas en Paraguay, es rentable?;Neutral
Alg£n m‚todo para ganar criptomonedas en py?;Alguna forma de generar dinero con criptomonedas en Paraguay, ya se invirtiendo o o gratis. O alg£n otro m‚todo de ganar dinero a trav‚s del celular?;Positivo
