titulo,cuerpo,sentimiento
Ley de Minería en Py,"Se aprobó la ley de minería en Paraguay, lo que convierte a esa actividad en una fuente gravada y regulada por el estado.

Obviamente la ley no da ninguna ventaja a los mineros, pero me pregunto si eso dejará la puerta abierta a que se empiecen a aceptar las criptomonedas como medio de pago.

Esta apertura, beneficiará o perjudicará al minero y a la sociedad? Ya que el senador Buzarquis está promoviendo el minado de BTC como si fuera la panacea a todos los males.



Saludos!",NEUTRAL
Criptos,Alguien sabe del grupo de pyos que tradean/holdean con criptomonedas?,NEUTRAL
JUEGOS NFT Y CRIPTOMONEDAS,"que tal gente, ¿Cómo andan?, Llevo un tiempo haciendo pequeñas inversiones en criptos y ahora me estoy metiendo en los juegos nft. Entre pensar y pensar me dió curiosidad saber si alguien de los compatriotas aquí presentes tiene alguna inversión con algún proyecto NFT? ya sea axie Infinity o similares",POSITIVO
Binance,"¿Se puede comprar Criptomonedas con la tarjeta prepago Pagopar o billetera Tigo, personal?",NEUTRAL
Cuando sos un rico pobre jaja hay que invertir en criptomonedas gente 😬,(sin texto),NEUTRAL
Forma efectiva de recibir dinero internacional?,"Que formas conocen de recibir dinero aca en paraguay por trabajos online? Ya que paypal no permite cobrar, como uno puede hacer para cobrar dinero por trabajo freelance, servicios como twitch/youtube o inclusive por compra/venta/mineria de criptomonedas? A ver si conocen algun metodo para retirar, o en todo caso alguna vuelta para hacer llegar el dinero a una cuenta bancaria.",NEUTRAL
Alguien tiene experiencia con Criptomomnedas?,"Buenas, hay alguna forma de recibir y enviar criptomonedas estando en Paraguay?

Basicamente me invitaron a una feria online para poder vender obras de arte y se realiza obviamente de manera online y el pago es mediante criptomonedas.

Alguna guia que pueda ver que me puede servir estando especificamente en Paraguay o algun dato relevante, todo es bienvenido, gracias!",NEUTRAL
Banco Central de Paraguay Señala que las Criptomonedas No Tienen Regulación en el País,(sin texto),NEUTRAL
Bancos de Paraguay cerrarán cuentas a un exchange de criptomonedas local,(sin texto),NEUTRAL
2025 en 10 años ahorros en Bancos o Ahorros en Bitcoin.?,"Si bien de aquí a 10 años el valor de la moneda se desvalorizara habrá obviamente siempre más inflación.
Tienes algún plan de ahorro en un banco?
Piensan que eso es mejor que Comprar y Holdear (hodl) Bitcoin de acá a 10 años el futuro será bitcoin.
Les aconsejo que vayan comprando. En 2009 valía menos de un dólar hoy en día es el boom 💥 
No olviden este post",POSITIVO
Encuentro Bitcoin en Encarnación.,"Hola a todos, me gustaría compartir con ustedes el encuentro bitcoin que se realizará en Encarnación, del grupo Bitcoin Paraguayo.

>🗣️ Únete a nosotros para nuestra reunión mensual de Bitcoin en Encarnación

>📅 Fecha: Viernes, 13 de Diciembre  
🕙 Hora: 19:00 - 22:00  
📍 Lugar: Galway Irish Pub 🍻

>Por favor regístrate aquí: [

>Habrá material informativo oficial de Bitcoin Paraguay para repartir. Se ayuda a configurar billetera Lightning, con sats de bienvenida 😊",POSITIVO
bitcoin,"no sé una chota de bitcoin, pero preciso abrirme una wallet. ¿qué es lo básico que debo saber? ¿algún consejo?

pd: para recibir pagos",NEUTRAL
Bitcoin comprar?,"A ustedes le aparece sugerencias de comprar Bitcoins?
Así como solían anunciarlo hace 10 años atrás?
Y que opinan?",NEUTRAL
Que opinan del Bitcoin en Paraguay,(sin texto),NEUTRAL
Es legal minar bitcoin en Paraguay?,Sé que hace poco rechazaron la regulación pero se puede minar igual? Vivo en el extranjero y estoy interesado en la idea de realizar esto en Paraguay.,NEUTRAL
Bitcoin en Parawhy,"Buenas a todos, estoy necesitando comprar Bitcoin (BTC), recientemente trate de hacerlo mediante Binance, pero por alguna razón no me deja hacer el pago con mi tarjeta (Tengo una prepago Visa de Banco Atlas) y la verdad que es demasiado quilombo esto del Bitcoin y quisiera saber si alguien a lo mejor maneja alguna pagina o alguna manera de comprar y transferir BTC en este pais de mierda donde aparentemente todo luego es imposible a no ser que vendas tu culo a la política la puta madre necesito ayuda.",NEGATIVO
ahorrar con sueldo minimo,"Un tema bastante difícil de encarar para algunos porque el sueldo es un tkk pero seguro que hay alguna manera de ahorrar y poder depositar en alguna cooperativa o banco con ahorro programado (no metan bitcoin porque es más complejo solo ahorro) y bueno sería interesante leer la opinión de algunos para ahorrar y tener algún fondo por si acaso. 


ALGUNA EXPERIENCIA CON BANCOS O COOPERATIVAS estaría interesante leer y sus métodos",NEUTRAL
Como comprar Bitcoin en Paraguay?,Cuáles son las opciones para comprar Bitcoin en Paraguay (cambiar PYG a BTC)?,NEUTRAL
cuándo pio se va ser oficial el bitcoin?,(sin texto),NEUTRAL
Que opciones pio hay para Bitcoin en Asunción,"Buenas,

Que otras opciones hay a parte de Cripex para cambiar bitcoin ? Conocen algo?

edit: efectivizar bitcoin creo que sería lo indicado",NEUTRAL
BTC sugerencias,"Buenas! alguien tiene experiencias de efectivizar bitcoin en PY?  Paypal es lo mas seguro pero como sabemos es imposible recibir en cuentas creadas en py, no se si es posible realizar transferencias a cuentas de Banco",NEUTRAL
"¿Qué pasó ayer con UniSwap? No entiendo nada, ¿cómo es posible que regalaran dólares?","**Buenas tardes, gente.**

Básicamente, lo que dice el título. Me desperté esta mañana con la noticia de que muchas personas ganaron entre 1200usd y 15000usd por haber hecho un par de transacciones con UniSwap.

No estoy muy metido en el mundo de las cryptos, lo único que conozco es Bitcoin y Ethereum, con las cuales nunca operé. Imaginense que no tenía idea de que existiera UniSwap.

Bueno, el tema es el siguiente, durante todo el día me llegaron posts en Facebook e Instagram de TronLink Pro, otra Crypto. En donde supuestamente hay que registrarse y te dan créditos.

¿Qué onda con esto? ¿Ustedes creen que puedan llegar valer algo esos créditos en unos meses? ¿Es seguro registrarse? ¿O te roban los datos?

**El mensaje siempre es el mismo:**

>""Si aprovechaste la oportunidad de los 400 UNI de UniSwap, hay otro Airdrop prometedor, TronLink Pro. Te dan 300 créditos con sólo registrarte.  
Paso 1: Descargar TronLink Pro en la app store.  
Paso 2: Crear una cuenta  
Paso 3: Luego de crear la cuenta, selecciona ""Me"" en el panel inferior.  
Paso 4: Seleccionar Invite a Friend  
Paso 5: Selecciona Claim Rewards e introduce el código 9Fbs y recibiras los 300 créditos.  
Los cuales podrían valer 50usd, 100usd o 500usd. Así sean 100usd, ya es ganancia por sólo dos minutos que te toma registrarte.""

No se, me parece sospechoso. Pero, por otro lado, me sentiría medio tonto si me entero en unos meses que esos ""créditos"" tenían valor....

Gracias, gente!",NEUTRAL
"En Paraguay, Ya Se Pagan Importaciones con Bitcoin",(sin texto),NEUTRAL
Crypto a Fiat en PY,"Buenas, desde hace 6 meses por ahi vengo minando ethereum ocasionalmente, la cuestion es de que no se como convertir ese dinero a FIAT sin pasar por traders (mala experiencia)
Tengo a mi disposicion tafjetas prepagas de Visa y Mastercard, hasta ahora en lo unico que pude usar el btc fue en giftcards amazon via bitrefill pero pegaria pagarse un asado con crypto jajaj

Pd. No es mucho, alrededor de 10usd - 20 usd semanales",NEUTRAL
Ayuda,"Buenas, estoy buscando algún vehículo. Que acepte  (ETH) como pago.",NEUTRAL
Ayuda con Asics de mineria crypto,"Hola gente, estoy interesado en adecuar mi local para minar btc, ya tengo las maquinas pero resulta que son demasiado ruidosas, alguien sabe o maneja alguna forma de silenciarlas sin que se calienten?
Ya les puse dentro de una estructura de paneles termoacusticos y espuma anti sonora, pero igual suenan fuertisimo",NEUTRAL
Usdt / btc,Alguien que tenga usdt para venderme ahora mismo? Soy de Asu. Para concretar por Binance,NEUTRAL
Cómo comprar BTC en persona en Ciudad del Este ?,"Hola gente,

Primero que nada bueno año a todos.

Quería consultar como comprar crypto (BTC) en Paraguay face to face, en particular en Ciudad del Este. Yo se que existen exchanges P2P como Binance pero quiero comprar en efectivo en persona (y en seguridad).

Me han dicho que existen casas de cambio que venden también BTC. Es así realmente ? Donde ?

Algún consejo ?


Muchas gracias",NEUTRAL
Wallet recomendada para tener crypto en PY,"Hace un tiempo vine a Paraguay migrando desde Argentina, pero lo que note fue que los bancos son muchísimos más exigentes con el origen de los fondos, mis finanzas o negocios allá no me sirven en este país como justificativo alguno por lo que, de momento, me veo limitado, de igual manera quiero tener una wallet que me sea funcional en territorio paraguayo para financiarme con lo necesario de momento. Yo en Argentina usaba Bitso y localbtc, pero quería saber si en Paraguay hay alguna wallet de confianza o que este más arraigada al estilo bitso. Necesito una wallet que pueda manejar tanto TUSD como BTC, localbtc la puedo usar para btc, pero no para TUSD así que esperaba encontrar algo de asesoramiento y ayuda, muchas gracias.

PD: si me pueden recomendar algún sub de finanzas de Paraguay les estaría agradecidos",NEUTRAL
Cryptocurrency exchange en Paraguay?,Existen exchanges de crypto en Paraguay? Para comprar y vender BTC por guaraní o dólares?,NEUTRAL
Comunidad Paraguaya en Hive,"Hola, después de mucho tiempo de no pasar por aquí, y estar tratando de utilizar mi tiempo en internet de forma más productiva, descubrí (más vale tarde que nunca) la Blockchain de HIVE, algo más descentralizado y que a diferencia de otras redes sociales, comparte sus ingresos con los usuarios que son los que generan el contenido.

Así pues, son invitados cordialmente a unirse a la Comunidad Hive Paraguay 



Y si lo estiman conveniente pueden utilizar el fronted de Ecency , que es uno de los más sencillos de usar. Les dejo mi link de referidos aquí 

Si necesitan alguna ayuda al respecto pueden escribir sus dudas en el tema e intentaré contestarlas apenas pueda o sepa.",NEUTRAL
Sistema financiero a nivel mundial,Que creen ustedes de que todo el sistema financiero va cambiar al blockchain dentro de 2 años? o mas?,NEUTRAL
El paraguayo no conoce la web.0 ?,"Pregunto en serio sin querer armar polémicas, pero por qué se emperran en usar la web2.0 que lo único que hace es robar nuestros datos, bombardearnos con publicidad, y de yapa algunos hasta pagan para tener un check azul.

Bueno, les invito nuevamente a unirse a Hive y a la comunidad HiveParaguay y marcar un poco de presencia allí, que parece que soy la única paraguaya que utiliza redes sociales de la web3.0



Edit: ¿El paraguayo no conoce la web 3.0 ?",NEUTRAL
Retirar plata de Airtm,"Buenas! Conseguí un trabajo remoto (!!!) y las dos únicas opciones para el pago son paypal y airtm, y honestamente no tengo idea de como funciona 😭 tengo que avisarle a mi banco? busqué otras preguntas relacionadas al tema acá y hablan de crypto y no entiendo absolutamente nada, ayudenme por favor",NEUTRAL
Recibir dinero del exterior,"Mbaeteko los perros. Hoy se celebra porque conseguí laburo remoto, mi pregunta es: saben cómo podría recibir dólares provenientes del extranjero de la forma más fácil posible? No me molesta pagar el fee del banco, solo que me contaron que son rompe bolas y te hacen rebotar y eso (y como es mi sueldo necesito que sea constante). Vi esa opción de uglycash, pero me da miedo que sea crypto, además me gustaría tener disponible en mi cuenta del banco para poder distribuir bien después (pagar servicios, hacer transferencias en guaraníes, etc.) y western unión no le quiero pedir a mi jefe que se vaya cada fin de mes a depositar tp. Alguien tiene experiencia con esto?",NEUTRAL
Youtubers en py.,"Estando Speed tan cerca no puedo evitar pensar en quien podría guiarle por acá en caso de que venga, y que loco no se me ocurre nadie tragable, puede ser que pase lo mismo que panamá, que fue una pasarela de personajes infumables.

Siempre me pregunte porque no hay youtubers paraguayos exitosos o medianamente conocidos por lo menos a nivel regional. Seguro hay poquísimos casos pero son excepciones.

Los que hay son medio meh o hay contenidos mejores, la mayoría tiene un humor insoportable que o es tercer tiempo versión a nadie o humor cheto que lo es mismo pero peor, aparte les llegas a conocer de verdad y son re a nadie, alzados re mala onda.

Igual la fórmula básica de un youtuber paraguayo suele ser: empezar haciendo comedia tipo enrique pavón versión ñembo moderno o intento de humor argentino, crecer’i y cuando apenas se asoma una pizca de popularidad empezar a trabajar con tigo promocionando boludeces o vendiendo crypto, incluso peor, fusionarse con la farándula de la tv.

En fin, mr. Graso es mi candidato más serio para guiarle a Speed.",NEGATIVO
Comisión baja remesa ARG/PY,"Buenas noches lectores. Tengo curiosidad de saber cuáles son las maneras más económicas y sencillas de enviar dinero desde Argentina hacia Paraguay. Agencias clásicas como Western Unión, etc están con comisiones por las nubes. Estuve evaluando envíos mediante crypto o alguna modalidad similar. Estaré esperando sus comentarios. Muchas gracias y feliz año!",NEUTRAL
Como trabajar remotamente en Paraguay? (Sin cosas que tenga que ver con crypto trading),Existen algunas plataformas que pueden ser de gran ayuda para trabajar de forma remota? Y si es posible una empresa extranjera,NEUTRAL
Límite de transferencias bancarias,"Cuánto es el monto maximo que se puede recibir o enviar sin tener que declarar o presentar algún comprobante de ingresos, (gano dinero vendiendo ítems de videojuegos a cambio de crypto y quiero saber cuanto puedo efectivizar)",NEUTRAL
"Hay que regular y liberar USDT, USDC. Costo de transferencia centavos de dólar VS 7% por métodos tradicionales","Remesas aportaron a la economía de Paraguay más de US$ 6.000 millones



Paraguay se halla entre países con alto costo como receptor de remesas



Remesas en Paraguay: situación e incidencia económica




Edición:
Paraguayos en el exterior pagan en total 40 a 50 millones de dólares por transferencia de remesas al país. 

Cosa que puede costar unos miles dólares en el peor de los casos con crypto monedas estables USDT o USDC.",POSITIVO
Binance en paraguay,"Hola gente perdón que recurra a este medio pero no tengo a nadie más que pueda ayudarme con una duda, quería saber si la única manera de efectivizar mi usdt acá en paraguay es por medio de la venta a alguien más y que me transfiera el dinero o hay alguna otra manera en donde no deba de haber un comprador? (Soy nuevo en esto de las crypto)",NEUTRAL
Declarar ingresos por trabajo en el exterior,"Hola! Actualmente trabajo para el exterior como programador hace varios años ya, me mude hace poco nuevamente a Paraguay y tengo la duda de como declarar mis ingresos ante los bancos. 

Tengo contrato, pero cobro a traves de crypto USDT, conocen algún contador que me pueda asesorar sobre el tema o que recomiendan? Ya me gustaria aplicar por una tarjeta de credito y esta un poco difícil.",NEUTRAL
Convertir crypto en Paraguay por tarjeta.,"Estoy buscando una forma de poder hacer uso de mis crypto monedas que tengo de forma rápida a través e una tarjeta, o que soporte convertir dentro a USD y usar así. Por ejemplo, tengo 100 USDT y quiero usar con una tarjeta. Que haya una que haga el intercambio al instante, o que yo pueda convertir previamente a USD y usarlo. No precisamente dólares, puede ser euros también. Todos los servicios de esa clase que encuentro son para Europa y algunos para EEUU. Ni para Argentina hay parece, por ejemplo 🤔. Si saben algo, les agradecería que lo compartan. Gracias!.",NEUTRAL
Empezar Emprendimiento,Que Emprendimiento empezarían con un presupuesto al rededor de 100 millones de guaraníes? Que no sea crypto...,NEGATIVO
Crypto Summit del sur! No se pierdan por CDE,(sin texto),POSITIVO
Que tal funciona Western Union?,"Hola, necesito enviar alrededor de 4 mil dólares desde USA a un familiar en Paraguay.

* Alguno de ustedes a recibido dinero a través de WU? 
* Que les pidieron para retirar el dinero (cedula?)? 
* Si o si debe recibir guaraníes o puede recibir USD?
* Conocen alguna alternativa para que pueda recibir ese dinero? (financiera, crypto, etc.)

Desde ya, muchas gracias por la ayuda :)",NEUTRAL
Este 7 de diciembre les invitamos al Crypto Summit del Sur a todos aquellos que les interese! Más info en www.cryptosummitdelsur.com 😊😊,(sin texto),POSITIVO
Cryptomineracion,Alguien por aqui hace mineracion de crypto en paraguay?,NEUTRAL
consulta cuenta bancos digitals,"hola buenas quiero hacerme una una cuenta en algun banco digital para usar binance (p2p crypto) cuales recomiendan ?

gracias",NEUTRAL
Alguien que haya minado con el Antminer S19,"Estoy interesado en comprar el Antminer S19 y quisiera saber que tengo que tener en cuenta al momento de comprar y utilizar la máquina 
Que piscinas de minería me recomiendan y como realizar las transferencias. Les agradecería su ayuda y opinión.",POSITIVO
PC Gamer y presupuesto,"Los perros, estoy queriendo comprarme una PC usada, no quiero armar una por los exhuberantes precios actuales, tengo un conocimiento muy básico de PCs, se que son cada componentes y para que sirven pero no te podría diferenciar cual es por ejemplo el que más me conviene, mis objetivos claros son poder jugar en al menos 2K los juegos en general, hablando de juegos actuales obviamente, a unos fps superiores a 60 (+100 ideales) en juegos mas competitivos, con todo esto vienen mis preguntas
1 - ¿Me conviene comprar una PC usada que no haya sido usada para minería? ¿O igual con los precios actuales es mejor armar una desde cero?
2 - Excluyendo periféricos ¿Cuanto debería de ahorrar para esto?
3 - ¿Que debería de estar buscando?, hablando de cosas más caras como tarjetas gráficas o procesadores",NEUTRAL
Busco consejos para mudarme e iniciar mi negocio en Paraguay,"Hola, soy de Brasil y estoy buscando mudarme y empezar un negocio en Paraguay.

Tengo muchas dudas sobre los tipos de empresa, pero me parece que SA es el adecuado, tengo la intención de abrir un negocio de minería cryptocurrency donde voy a ser el único empleado.

También tengo la intención de vivir en Paraguay, pero tengo muchas dudas acerca de los documentos que necesito obtener, la apertura de un banco en Paraguay y la burocracia que implica la apertura de la empresa. Lo más fácil para mí es viajar a Paraguay....

¡Cualquier sugerencia o consejo que me ayude en mi viaje será muy apreciado!

Gracias!",NEUTRAL
Alguien sabe dónde puedo conseguir una 3070ti no muy cara,"Creo que el más barato que ví fue 4 millones pero era usado (y no sé si para minería), y uno nuevo lo más barato que ví fue en Nissei a 6 palitos por ahí, por si alguien sepa de más lugares",NEUTRAL
Minería de criptos en Paraguay,"Buenas, además de Cripex, conocen a alguien que mine criptos?",NEUTRAL
Binance Paraguay?,"Buenas a todos, alguien de aquí tiene una experiencia con comercio P2P en binance (Como vendedor) me puede comentar sobre la experiencia, cuánto es posible ganar por día y si vale la pena...
Mi capital sería de 1.000$ aproximadamente",NEUTRAL
Viajar a Paraguay y usar PayPal,"Hola, tengo una pregunta, estoy planeando visitar Paraguay por un tiempo (temporal), pero he leído que la situación con PayPal es complicada. Yo tengo mi cuenta PayPal desde hace más de tres años, trabajo por plataformas como Fiverr y directamente con algunos clientes que me pagan mediante PayPal, y luego de PayPal lo paso a Binance mediante p2p. 

Es esto posible de hacer en Paraguay? O inmediatamente al entrar en territorio paraguayo deja de funcionar la página y la aplicación móvil de PayPal? 

Si alguien tiene alguna ayuda, o conoce a alguien con alguna experiencia similar, se aprecia la ayuda.",NEUTRAL
"Comerciantes que hacen p2p cuidado, hay muchas cuentas vendidas que tienes personas de Asia , que están haciendo estafa","Primero que nada gente soy comerciante verificado de Binance, ultimamente ha aparecido varios cuentas alquiladas de paraguayos que dieron sus usuarios de binance a un grupo asiatico de indonesia o blangades  creo, actúan como titulares, y hasta tienen su documentos de identidad que estan usando estos estafadores, principalmente este post es para algunos que comercian en p2p y venden usdt para que presten mas atención para cuidarnos, están usando a la gente y su cuenta bancaria con binance  para mover la plata del estafado.",NEGATIVO
Denunciado por hacer p2p en Binance,"Me gustaría contarles lo que me está pasando últimamente para ver si alguien con experiencia o que le haya pasado me de algunas indicaciones, Al principio de mes cobré mi salario, trabajo Home office y me pagan en dólares, en una aplicación que se llama ontop en el cual puedo elegir la opción de enviar dinero a mi cuenta, por conveniencia y eso que ya tengo varias transacciones realizadas decidí enviar a mi Wallet de Binance, me meto como de costumbre a p2p y vendo mis usdt como de costumbre, verifico el dinero recibido, está correcto y transfiero todo bien, a las pocas horas voy  retiro el dinero sin problemas, luego de pasar los días me doy cuenta que mi cuenta bancaria está bloqueada, voy al banco y me dicen que tengo  una denuncia, me quitan la tarjeta, me dicen que si estoy de acuerdo que devuelva el dinero, le digo que no. Tuve que hablar con un abogado y averiguamos que la denuncia en la fiscalía fue hecha en Caacupe y está siendo investigado, ahora tengo que ir hasta allá (soy de CDE) y tengo que pagar abogado y demás cosas para limpiar mi nombre. A alguien ya le pasó esto?",NEGATIVO
Alguien que me pueda hacer transferencia a Wise en dólares ?,"Hola estoy necesitando dólares para pagar algo en Europa y me gustaría comunicarme con alguien que tenga en su cuenta de wise para hacer un P2P en persona, en total necesito 1779 dólares",NEUTRAL
Binance app en paraguay,"A alguien más le pasó que al intentar vincular mi número de celular a binance no les llega el código de verificación?
Sin esa verificación no puedo comprar y vender en P2P ya que la app no me permite a menos que verifique mi número de celular, aunque nunca me llega el código de verificación, alguien sabría alguna solución para esto?",NEGATIVO
Convertir criptos a guaranies,"Ahora mismo que las criptos están en auge y que probablemente siga subiendo por el halving surge la pregunta sabe si hay forma de transferir las criptos directamente a una cuenta bancaria? La única que yo se es vendiendo tus criptos en p2p osea que el comprador te transfiera los guaraníes a tu cuenta pero creo y entiendo que en otros países se puede transferir a la cuenta bancaria sin necesidad de estar vendiendo nada, si alguien sabe de otra forma favor confirmar",NEUTRAL
Tengo p2p en binance y no puedo retirarlo,"Tengo p2p en binance y no puedo retirarlo porque Tigo Money no funciona, y no tengo cuenta de banco o tarjeta, qué puedo hacer??",NEGATIVO
