titulo,cuerpo,sentimiento
Trading en Tiktok,"Que onda derrepente cada vairo que ofrece su curso, antes co el novio de la onichan nms era pesado pero ahora se reproducieron   Hasta ese man que hacía tiktok de macanadas en el mercado 4 co hace TRADING, después esta ese Aquino que con un cripto cada tanto gua’u efectivizar y para colmo tiene gente boba que comenta toda la hora brooo líder espectacular quiero entrar al curso🙏🙏 tenes que irte de viaje también a dubai vos líder 🙏🙏🙏, se están volviendo peor que los colorados",NEGATIVO
Percibir salario desde trabajo remoto,"Hola, el próximo mes empezaré a trabajar remoto para una multinacional extranjera. Puedo cobrar en USD o en cripto... Ustedes que todo lo saben... ¿Cuál es la mejor opción?
Si es en USD, ¿qué bancos recomiendan y por qué?  
Si es en cripto, ¿qué billeteras recomiendan y por qué?
  ¿Sería buena idea cobrar una parte en USD y el resto en cripto? Compartan su experiencia /tips",NEUTRAL
Apple gift cards,"Tengo 400$ en Apple gift cards y quiero vender. Ya sea transferencia o cripto. 
Vendo 100$ de gift cards por 95$",NEUTRAL
Recibir pagos del exterior sin tener problemas con Set,"Como paraguayo cual es la manera más simple de cobrar por trabajos que sea compatible freelancer y fiverr? Sin tener que hacer jugadas de convertir la plata a cripto, luego a euros y luego a guaraníes?",NEGATIVO
Tarjetas de credito cobrando en cripto,"Alguien sabe si hay alguna forma de que ciertos bancos me habiliten tarjetas de credito si cobro en cripto?  Trabajo para una empresa de afuera y cobro en dolares, para ahorrarme gastos cobro en cripto pero ulltimamente estoy queriendo quitar tarjetas de credito y no se como poder blanquear eso, consejos?",NEUTRAL
"Estaría interesante conocer personas que esten metidas en el mundo cripto y el trading para intercambiar palabras, escriban!!",(sin texto),POSITIVO
Hay alguna forma práctica de cambiar cripto a Gs. para no residentes?,"O sea, para alguien que no tenga cuenta bancaria allá. 

Hay algún método confiable y que no te maten con la comisión?",NEUTRAL
Ganar plata en Paraguay siendo joven y con poco capital,"Buenas, tengo 20 años y soy de Asuncion, estoy actualmente estudiando ing. informatica y estoy queriendo invertir en algo que no requiera mucha inversion, algun emprendimiento, actualmente tengo un trabajo pero pagan menos que el minimo y me cansa y deseo tener una forma mejor, mas flexible y que pueda hacerme me plata y estoy viendo opciones.

Entre las cosas que ya probe esta el trading y lo relacionado a cripto, es rentable pero no tanto, y muy facil de perder lo que ganaste si haces algo mal, lo que si estuve pensando en algun tipo negocio de aplicacion de herramientas(o creacion de estas) de IA a negocios, enfocandose en pequeñas y medianas empresas, o tambien alguna tienda online para venta de productos al por mayor(mas para que empresarios compren sus productos de ahi, una especie de alibaba), o algo de servicios de marketing pero no se la demanda que estas pueden tener y no quiero inevrtir mucho tiempo en algo que no me vaya a servir en nada luego, que recomiendan o que ideas dicen pueda probar? tambien estaria bueno si dicen alguna app que les gustaria tener en su tel o un servicio que no haya o haya poco en el pais.",POSITIVO
Paraguay y criptomonedas,"Me gustaría hablar sobre un tema un poco delicado: Cripto en Paraguay.

Últimamente, está teniendo un boom en Paraguay, con varias noticias sobre proyectos de ley y con varios exchanges locales. Lo que sí, quise probar y me fui a los tres más ""grandes"" o más renombrados: Cripex, Bitbase y X4T, además del P2P.


Cripex parece que ya ni existe, su sitio web no funciona y no se puede contactar a nadie.

En Bitbase quise comprar Bitcoin por 200.000Gs. Primero, me dijeron que necesitaba una wallet propia, cosa que no tenía. En la tienda venden algunas, pero cuestan más de 100$ y son mucho más caras que en Amazon y otros lugares. Un amigo mío tiene una wallet para recibir Bitcoin, así que lo hicimos con su wallet. Y ahí vino la gran sorpresa:  
en una compra de 200.000Gs hubo una comisión de 36.373Gs, ~18,37%. Además, nos dieron un tipo de cambio falso. El tipo de cambio oficial era 1BTC=213.251.786 en julio del año pasado cuando compré. El tipo de cambio de Bitbase era 1BTC=274.857.417. Eso es una diferencia de casi el 28,89%. Si sumamos ambas ""comisiones"", Bitbase cobró una comisión de 47,26% sobre una compra de 200.000Gs, unos 94.520Gs. No me avisaron de estas comisiones antes y me siento estafado.

Después escuché sobre X4T, una exchange nueva acá en Paraguay. El registro fue rápido y también te dan una wallet gratuita para recibir, enviar y comprar Cripto. Ahí también podes comprar Cripto por efectivo o vender. Además, ofrecen transferencias bancarias y ahora una tarjeta de débito, que para mí en lo personal es cara, pero para los que están bien metidos en el mundo Cripto y valoran la anonimidad, les puede interesar. No hubo comisiones para el depósito, solo cobran 2%-3% para retirar. El soporte es súper útil y me explicaron todo lo importante como novato, además pude contactar al soporte vía WhatsApp para cualquier otra duda.

Mi amigo mencionó que siempre hace P2P. En este caso, te encuentras con un comprador/vendedor, según lo que necesites, y podes cambiar cripto por efectivo. Se encuentran en la casa de alguien o en otro lugar y ahí hacen la transacción. A él le funciona bien, pero es un proceso increíblemente complicado para principiantes y además mucho mas caro. Los vendedores cobran entre 6%-15%, lo hacen de manera ilegal y todo el negocio se basa en ""confianza"".

Tengo curiosidad de ver hacia dónde va todo esto del Cripto y qué dice nuestro gobierno. Personalmente, me gustaría que los bancos pierdan su monopolio y que Bancard no controle todas las finanzas del país.",NEGATIVO
"Paraguay prohíbe cripto. Debo vender mi Bitcoin antes de la nuevo ley o que? No quiero estar criminal. No soy minador, solo tengo un poco Bitcoin como inversion.",(sin texto),NEGATIVO
¿Cómo retirar BTC de minería de manera legal?,"Tengo ahorrado una cantidad de BTC en mi cuenta de Binance que acumulé haciendo minería de cripto. Sé que existe la posibilidad de retirarlo con p2p, así que recibo una transferencia en guaranies en mi banco de alguna persona.

Mi pregunta es si voy a tener problemas por recibir una transferencia random de una persona en mi cuenta (supongamos 10 millones) y como se debe declarar eso legalmente y si se debe pagar IRP o hacer factura por el monto.

¿Alguien sabe o tiene experiencia?",NEUTRAL
World app,Gente alguien sabe como se canjea esta cosa en varias redes sociales suelo ver gente canjeando esa cripto alguien sabe como funciona,NEUTRAL
Minerar Cripto en Paraguay,"Quiero consultarles si alguien sabe que se necesita, documento, patentes, etc. Para minar en Paraguay tambien si se puede hacer en una casa particular y tiener todo legal con el permiso de la ande, te pueden crear problemas igual, en conclusión yo quiero comprar un transformador de 150KVA, pedir permiso en la ande, pagar el consumó que sea y colocar en una casa (que no es mi casa, ejemplo una casa alquilada) y mi duda es si me puede venir la fiscalia o alguna entidad reguladora entonces les pregunto si saben algo al respecto.",NEUTRAL
Turbio?,"Brock Pierce , magnate de cripto,  vinculado presuntamente a un circulo de  pedofilia en Hollywood en los años 2000 junto con el director Bryan singer y Marc Collins - Rector ; se reúne con el ministro de tecnología, también con el  ministro de industria y comercio  con la idea de "" impulsar la tecnologia"" en paraguay. Un poco raro que hagan negocios con este tipo  considerando que en paraguay abundan los casos de pedofilia. 



 Que piensan ?  Les dejo unos vídeos/documentales que profundizan más sobre el tema.",NEGATIVO
Minar cripto py,"Hola gente, hay algun entendido sobre como minar cripto de forma correcta?, o si saben de alguien que lo haga de forma segura? sobre los precios de sistema, equipos, refrigeracion, incluso precios de consumo electrico?? Es rentable siquiera? 😅",NEUTRAL
Consulta,"Para mis amigos traders de este pais y gente que conozca del tema; quiero hacerles una consulta. 

Ustedes tienen problemas para comprar cripto con la tarjeta Pagopar Vision en Binance? Mandé renovar mi tarjeta porque se había vencido y ahora no puedo comprar en Binance. Me sale un mensaje que la tarjeta no esta habilitado para compras internacionales. Pero con la misma tarjeta uso para pagar Spotify, por ejemplo. Si a alguien le pasa lo mismo y tiene una solución, pol favol... Compaltan!",NEUTRAL
GANAR DINERO EXTRA,"Cúal creen que sea un método escalable de ganar en Paraguay? Que tipo de emprendimiento creen que se puede empezar desde poco dinero y escalar de una buena manera? Alguien que entienda más a fondo? Me gustaría poner a trabajar el poco dinero que tengo ahorrado, pero los intereses del banco generan muy poco y no pueden con la inflación. No les pido que cuenten sus secretos de como ganar dinero, si no algunos tips o metodos para Sobresalir. Me interesa mucho el tema de invertir, pero no me interesa todo lo que sea cripto y esas cosas piramidales de internet. Espero que los comentarios tambien le sirvan a otras personas que están en la misma situación. Actualmente estoy trabajando pero no me alcanza, me gustaria ganar dinero de otras fuentes. Les leo y de antemano agradezco",NEGATIVO
Compras online desde Argentina,"Hola!, creo este post para consultar si alguien sabe como comprar desde Argentina en los sitios web de Paraguay como nissei, chinashopping, megaelectronicos, mobilezone, etc y no morir en el intento. Cuento solo con cripto y las tarjetas que tengo no tienen el límite que necesito, lo que está haciendo que se convierta en un gran dolor de cabeza.

La idea es comprar las cosas por mi parte y enviar todo a lo de un amigo para que me lo traiga a Argentina.

Opciones que encontré:  
Lemon cash, vi que los montos de operaciones son altas y los límites de compra son muy bajos, necesito por lo menos poder contar con montos de 4 playstation 5.

Tarjeta binance, no encontré límites de compra y no sé si es posible usarla en el país.

Me ofrecieron una persona que puede ir a comprar, pagar en moneda local, retirar y entregar al domicilio que necesito pero con un costo elevado en dolares por cada comercio.

Otra alternativa que me ofrecieron sería con un servicio de ""shop for me"" que, pese al honorario adicional en dolares, resulta la mejor opción hasta ahora.

Si alguien tiene info al respecto se lo agradecería.",NEUTRAL
Tengo 15 millones,Que negocios más o menos recomiendan con esa cantidad de capital... Nada que sea cripto o pirámides,NEGATIVO
Ingreso segundario en paraguay,"Buenas tardes para todos, me podrian ayudar con una idea de ingreso segundario en Paraguay?.

Estoy buscando generar otro ingreso a parte del que ya tengo(trabajo en una empresa), busco uno fisico que no sea tipo inversion digital o algo de cripto y demas. Sino uno fisico, venta de productos o algun negocio.

Si alguien tiene experiencia en eso y me pueda ayuar porfa

Gracias !",NEUTRAL
"Billetera cripto: gente, evidentemente dejar criptomonedas en exchanges está visto que no es seguro (sobre todo al ver lo de FTX). Que Wallet recomiendan? Que sea segura sin que sea una cold Wallet?",(sin texto),NEGATIVO
mineria de criptomonedas,"Buenas tardes gente quisiera saber como podria minar cripto desde casa, cuanto es la capital o fondo minimo que necesito para empezar y si vale la pena, tambien me interesaria saber alguna sugerencia acerca de que cripto podria minar, ya que últimamente me empezo a interesar el tema por que lei que el costo de electricidad de este pais es ""bajo"" en relación a los otros países donde mas bitcoins se mina",NEUTRAL
"Bitcoin en Paraguay; amigos que usan cripto en Paraguay ""no justamente como inversión"" sino para hacer sus transacciones compra venta; mejorar aplicaciones para comprar, experiencias buenas/malas.?",(sin texto),NEUTRAL
Ingresar dinero de venta de criptomonedas en la banca paraguaya,"Hola, ¿alguien se maneja en cripto por aquí?. Me consta que en Paraguay la ley permite cambiar criptomonedas por dinero de curso legal y por bienes y servicios pero a la vez los bancos parece que no aceptan dinero proveniente de esas actividades. ¿Alguien conoce qué formas usan los inversores cripto para meter su dinero en el banco?",NEUTRAL
Cryptomonedas y un paraguayo viviendo en el extranjero. Situación legal ?,"Hola redditors. Como andan ?

Soy paraguayo viviendo en Europa hace unos años ya, me fui de CDE hace 10 años. Estoy de visita por el subreddit r/Paraguay  para saludar y sacarme unas dudas.

Yo tengo un poco de crypto ahorrado (no mucho) y pienso, cuando vuelva a Paraguay como podre hacer para poder convertir las criptomonedas en fiat (dinero tradiccional guaranies/dolares) ?

Cual es la situacion legal del cripto alla ? Es para como funciona la imposicion fiscal y cuando hay que pagar. Si tienen algun consejo les agredeceria.

&#x200B;

Gracias y saludos",NEUTRAL
¿Alguna forma de depositar dólares en algún banco sin pagar comisiones por depósito?,"Hasta ahora sé que se pueden hacer transferencias de una cuenta de dólares a otra en dólares sin comisiones. La otra forma que sé es haciendo una transferencia SWIFT a un banco extranjero (pagando en efectivo) y luego mandando el dinero a PY de nuevo, pero solamente funciona con cantidades muy grandes de dinero, ya que igual cobran comisiones por envío y depósito.

Si saben alguna forma para transformar dólares en efectivo directo a cripto también sirve.",NEUTRAL
Ganar cripto fácil? Lee esto!,(sin texto),POSITIVO
"PayPal, crypto u otros","Buenas. Tengo el siguiente problema. Empecé a trabajar online, en una plataforma que se llama Cambly. El tema es que solo pagan por PayPal. Tengo cuenta, pero entiendo que no podré retirar la plata acá en Paraguay. Estoy viendo maneras para poder efectivizar lo que gano. Las dos opciones que tengo creo que son comprar cripto monedas con lo que me pagan a paypal, o abrir una empresa en Estonia, y de ahi poder hacerme transferencias bancarias.

&#x200B;

Hay alguna otra opcion? Estuve investigando tambien TransferWise, Neteller y Payoneer",NEUTRAL
Cripto Moneda,Que saben de Cripex o de cripto Moneda en paraguay? Se puede operar y comprar Bitcoin/Ethereum?,NEUTRAL
$$,**Alguien que invierta en la Bolsa?? que no sea Cripto.**,NEGATIVO
Ayuda con ciberseguridad,"Buenas, hace dos semanas recibi un correo (21/4) el mismo fue enviado desde mi cuenta de microsoft y estaba entre correos no deseadsos, lo abro hoy y es un mensaje diciendo estar infectado con pegasus y para pasar cierto monto en criptomonedas, además de que el mensaje sería notificado una vez abierto (hoy), no tengo mucha seguridad con el mismo y quisiera saber si alguno podría dar una mano con eso, hay forma de identificar la veracidad de este?",NEGATIVO
Criptomonedas.,"Buenas gente, alguien sabe desde que plataforma puedo efectivizar bitcoins en paraguay para hacer el retiro desde mi cuenta bancaria?.",NEUTRAL
Que opinan del trading?,"Les párese una estafa el tema del trading? Yo planeo invertir 10 dólares alprincipio para ir probando y una ves que me valla bien invertir cantidades ya más altas, el broker que utilizaré será binance y será el trading de criptomonedas, que opinan...",POSITIVO
Mineria ¿ilegal?,"Acabo de ver un posteo en X de la Fiscalia jactandose de un procedimiento por haber descubierto una granja de mineria ""clandestina"" de criptomonedas. 

Que yo sepa no es una actividad regulada, ¿cual es la ""clandestinidad"" de una actividad de ambito provado en una propiedad privada que no esta prohibida por ley?

Se me ocurre que la conexion electrica puede ser clandestina (suelen recurrir a eso los cachafas porque se consume mucha energia electrica) aun asi no es motivo suficiente para ingresar a tu propiedad e incautar equipos, las conexiones clandestinas son un delito de accion penal privada, la ANDE debe documentar y demandar. 

Me llama la atencion que nadie conoce sus derechos y la gente en general no sabe diferenciar estas cosas. 

¿Que aprendieron en la escuela?",NEGATIVO
Cómo hacen para cobrar en USDT o criptomonedas sus trabajos? y en que plataformas o apps lo hacen? Fiverr y upwork no tienen esas opciones,(sin texto),NEUTRAL
Crypto,"Quiero iniciarme en el mundo de las criptomonedas, algún curso gratuito que recomiendan? Mi conocimiento acerca del tema es prácticamente nulo, me gustaría aprender a comprar cryptos, pagar, transferir, etc.",POSITIVO
Estadounidense buscando hacer amigos en Paraguay,"¡Hola otra vez más! Soy estadounidense y estoy planeando mudarme a Paraguay. Me gustaría hacer amigos locales, pero tengo algunas reservas al respecto. He notado que muchos de los expatriados en Paraguay son personas vinculadas al mundo de las criptomonedas, antivacunas, teorías conspirativas, y evasión de impuestos. Honestamente, no es mi tipo de gente, y no me atrae mucho ese ambiente. También he visto que muchos llevan vidas bastante lujosas y no suelen mezclarse con personas fuera de su clase social o económica. Yo, por el contrario, llevo una vida más modesta, sin lujos, y mi objetivo es conectar con paraguayos de clase trabajadora y clase media.

Quiero agregar que, en mi experiencia viviendo en otros países de América Latina, ha sido realmente difícil hacer amigos, especialmente en culturas más conservadoras, por el simple hecho de ser extranjero. Donde vivo ahora, la gente es amable, pero nadie se acerca lo suficiente para llegar a ser amigos. La mayoría de las personas con las que interactúo se sienten incómodas por el hecho de que soy extranjero, son muy penosas, y asumen que voy a sentir desprecio por su estilo de vida, que los miraré de menos o que de alguna manera los humillaré.

Entiendo y reconozco la validez de sus reservas, pero nunca miraría a alguien de menos por tener menos recursos económicos, educación, posesiones, etc. No me siento como alguien ""fresa"" como dicen los mejicanos o ""cuico"" como dicen los chilenos. Me siento igualmente cómodo en una casa con cerámica y aire acondicionado como en una con piso de tierra y poco más. Los únicos que realmente han sido acogedores hasta ahora han sido los evangélicos, y aunque muchos de ellos son buena gente, no soy religioso ni me interesa hablar de todos los temas a través de la lente del cristianismo.

Mi pregunta es, ¿estoy a punto de enfrentarme a una situación similar en Paraguay, o existe la posibilidad de hacer amigos en lugares fuera de Asunción, como Paraguarí o Caacupé? ¿Es probable que pueda encontrar personas con intereses similares a los míos en estas áreas, o en Asunción también, que no tendrían pena por conocerme? ¿Dónde los puedo encontrar?

Me gustaría conocer gente que disfrute de leer una buena novela, estudiar historia por diversión, discutir política y temas sociales, contribuir de manera desinteresada a su comunidad, pasar tiempo en la naturaleza, el arte, la música, etc. En resumen, busco conectar con personas auténticas que valoren las cosas sencillas de la vida. 

Sé que abundan ese tipo de gente en nuestro mundo, solo quiero saber dónde los puedo encontrar en Paraguay y si existen algunos que no tendrían pena de conocer un gringito como yo jaja!

¡Gracias de antemano por cualquier consejo o recomendación que puedan compartir!",NEUTRAL
Bitcoin,"Alguien que esté en el tema.??
Me gustaría comprar Criptomonedas de manera totalmente anónima y efectivisarlo a futuro.",NEUTRAL
Dinero del extranjero,"Después de leer varios posts, la mejor opción para retirar dinero del extranjero sería por medio de criptomonedas? Pero luego cómo pasar las criptos a guaraníes alguien sabe??",NEUTRAL
La ANDE últimamente anda incautando muchas máquinas de Criptomonedas. la gente es muy evidente o como creén que son descubiertos?,(sin texto),NEGATIVO
Dónde cambiar criptomonedas a dólares o guaraníes en Paraguay?,Experiencias usando criptomonedas en Paraguay,NEUTRAL
Pagar con criptomonedas en comercios o lugares gastronómicos en Paraguay,Alguna experiencia de locales comerciales que acepten criptomonedas en Paraguay?,NEUTRAL
Comprar auto al contado,"Hola! Quisiera saber si se puede realizar la compra de un auto al contado en efectivo, y si piden origen de fondos, trabajo para el exterior y cobro en criptomonedas y me seria un poco complicado justificar, existe un monto máximo? O que recomiendan.

No se si solamente mi contrato con la empresa serviria para justificar los fondos?",NEUTRAL
Hay alguna forma de trabajar con binance desde Py,Veo que hay restricciones para poder operar o hacer traspaso de dinero mediante banco a Internet mediante páginas de criptomonedas o traiding,NEUTRAL
"CDE Dónde hay locales físicos de Exchange de criptomonedas (DAI, Thether) a Guaraníes/USD",(sin texto),NEUTRAL
Independizacion? en Paraguay?,"Me graduo en 2024 y busco independizarme de mis padres. Que tan factible es? Cuales serian unos pasos o tips para poder independizarme?

La idea que tengo primero es; conseguir un laburo, conseguir un auto. Hacer uber despues de salir del trabajo. Juntar plata y despues buscar un depto que no sea tan caro, mudarme al depto con un colchon y de ahi crecer de a poco. 

Buscando online veo gente que dice de conseguir un ingreso pasivo y esas cosas pero realmente eso no funciona en paraguay. Si para mantenerme el dia a dia ya utilizo todos mis ingresos, como es posible un ingreso pasivo? Nada de inversiones y criptomonedas y esas macanadas. 

Como se independizaron? Es realmente cara la renta en asuncion? o debo ir a luque/mariano/fernando de la mora?",NEGATIVO
Ideas para ingresos pasivos en PY?,"Digamos que por motivos de formación académica no puedo trabajar, solo estudiar, alguien sabe en que puedo invertir que me genere ingresos pasivos algo asi como la minería de criptomonedas.",NEUTRAL
CRIPTOMONEDAS EN PARAGUAY,"Buenas muchachos, como están?. Quisiera saber si alguno de ustedes tiene experiencia comprando CRIPTOMONEDAS y/o grupos donde pueda unirme para aprender más acerca de eso, lo quiero hacer como un hobbie porque me llama mucho la atención, el otro día compré una DOGECOIN por menos de un centavo de dólar, y quiero de a poco ir aprendiendo más acerca de cómo ganar plata con eso, cualquier ayuda se agradece.",POSITIVO
Criptomonedas,Conocen alguien que compre criptos? A cambio de dólares o guaraníes? O alguna casa de cambio exclusivo de criptos. Cualquier info me vendría bien,NEUTRAL
Cryto,"Que piensan de la minería de criptomonedas en Paraguay, es rentable?",NEUTRAL
Algún método para ganar criptomonedas en py?,"Alguna forma de generar dinero con criptomonedas en Paraguay, ya se invirtiendo o o gratis. O algún otro método de ganar dinero a través del celular?",NEUTRAL
Efectivizar Criptomonedas en Paraguay,"Buenas a todos.

Como puedo efectivizar mis criptomonedas aquí en Paraguay? Tengo BTC, ETH, USDT pero quiero efectivizarlo a Gs o USD, cualquiera de las dos me sirve. Si alguien podria guiarme como, si hay una entidad en donde acudir o cualquier otro método.",NEUTRAL
Efectivizar Criptomonedas,Saben como puedo efectivizar mis criptomonedas acumuladas en binance? tengo unos dolares acumulados pero no se como puedo efectivizarlos...,NEUTRAL
criptomonedas en paraguay,Saben como puedo comprar bitcoins o alguna moneda desde paraguay? Satochipa te cobra una comisión muy alta y desde apps que conozco solo se puede comprar mínimo 30$,NEUTRAL
Dónde comprar criptomonedas en Paraguay?,"Buenos días, estaba buscando la forma de comprar algunas criptomonedas pero hasta ahora no encontré ninguna forma de comprar criptomonedas de forma segura al menos en Paraguay. ¿Que página o App recomiendan para adquirir?",NEUTRAL
"Trabajo para una grande empresa de minería de criptomonedas en Paraguay, hagan sus preguntas.","Responderé todo lo que no sea de carácter personal o confidencial, come on!",NEUTRAL
"Crypto en Paraguay, ¿ya están bien utilizados?","¿Ustedes de Paraguay usan criptomonedas?  Soy de Brasil, si voy con dólares en binance, ¿podría retirar estos dólares?  ¿Las tiendas aceptan criptomonedas?",NEUTRAL
"Criptomonedas; que opinan del proyecto de ley; a favor, en contra, sugerencias?",(sin texto),NEUTRAL
¿Como invertir?-Criptomonedas/Trading,"Me surge la pregunta si es conveniente invertir y si es rentable con poco riesgo de pérdida 
Alguien conoce Comerce IQ?",NEUTRAL
Crypto mineracion en Paraguai,"Alguien por aqui Hace mineracion de Criptomonedas en Paraguay?

He visto varios videos de personas usando Asics y gpus en Paraguay, qual es el kwh ?",NEUTRAL
"Buenas, alguno aquí utiliza la aplicación Hapi (App para comprar acciones, ETFs y criptomonedas desde Latinoamérica) que tal es aquí en Paraguay? O si me recomiendan alguna para empezar con el trade de acciones!?",(sin texto),NEUTRAL
¿Hay manera de comprar comida con criptomonedas?,"Hola, conseguí un ""trabajo"" por internet y me depositan en USDT, me gustaría saber si existe alguna opción para hacer compras, específicamente de comida a través de criptomoneda en Paraguay, estuve investigando un poco y vi que existen esos servicios en Chile, Argentina y México, pero sobre Paraguay no encontré nada y la verdad que tampoco estoy muy esperanzado de que se pueda, pero si alguno conoce de algún supermercado/restaurante que acepte criptomoneda estaría bueno que me lo pueda recomendar :D",NEUTRAL
